imdb_id,original_title,alternative_titles,release_year,genres,directors,actors,summary,length,rating,rating_max,rating_num,detail_url,poster_url,backdrop_url,status
tt0467406,Juno,Juno/Джуно/주노/鴻孕當頭/Junebug/朱诺/Џуно/ג'ונו/Džuno/Juno: Nezrelá na dieťa/JUNO／ジュノ/Juno: Crecer/correr y tropezar/Dính Bầu/Juno少女孕記/จูโน่...โจ๋ป่องใจเกินร้อย/جونو,2007,Comedy/Romance/Drama,Jason Reitman,Elliot Page/Michael Cera/Jennifer Garner/Jason Bateman/J.K. Simmons/Allison Janney/Olivia Thirlby/Eileen Pedde/Rainn Wilson/Daniel Clark/Darla Fay/Aman Johal/Valerie Tian/Emily Perkins/Kaaren de Zilva/Steven Christopher Parker/Candice King/Sierra Pitkin/Cut Chemist/Eve Harlow/Kirsten Alter/Emily Tennant/Ashley Whillans/Jeff Witzke/Colin McSween/Peggy Logan/Cameron Bright/Joy Galmut/Wendy Russell/Robyn Ross,"Faced with an unplanned pregnancy, sixteen year old high-schooler, Juno MacGuff, makes an unusual decision regarding her unborn child.",96,3.8,5,1308023,https://letterboxd.com/film/juno/,https://a.ltrbxd.com/resized/film-poster/4/8/0/5/1/48051-juno-0-230-0-345-crop.jpg?v=19ad3fb7e5,https://a.ltrbxd.com/resized/sm/upload/0h/2u/4h/xz/juno2-1200-1200-675-675-crop-000000.jpg?v=7e9803c259,Success
tt5537002,Killers of the Flower Moon,Killers of the Flower Moon/Вбивці місячної квітки/Gray Horse/킬러스 오브 더 플라워 문/Flower Killing Moon/قاتلان ماه گل/𐓀𐒻͘𐓂͘𐓄𐒰 𐒹𐒿𐒰𐓆𐒼𐒰 𐓓𐒻͘𐒼𐒰 𐓊'𐒷𐓍𐒷/KOTFM/花月殺手/Çiçək Ayın Qatilləri/花月杀手/Вбивці квіткової повні/Czas Krwawego Księżyca/'플라워 킬링 문' - Killers of the Flower Moon/Asesinos de la Luna/La note américaine/Assassinos da Lua das Flores/Ծաղկի լուսնի սպանողներ/Убийците на цветната луна/Убийцы цветочной луны/Los asesinos de la luna/플라워 킬링 문/Megfojtott virágok/كيلرز اوف ذا فلاور مون/Vầng Trăng Máu/Dolunay Katilleri/キラーズ・オブ・ザ・フラワームーン/רוצחי פרח הירח/Zabijáci rozkvetlého měsíce/Czas krwawego księżyca/Gėlių mėnulio žudikai/คิลเลอร์ส ออฟ เดอะ ฟลาวเวอร์ มูน/قاتلان ماه کامل/Ubojice cvjetnog mjeseca/Ziedu mēness slepkavas/Vrahovia mesiaca kvetov/Убиства под цветним месецом/Οι Δολοφόνοι του Ανθισμένου Φεγγαριού/Çiçəkli Ayın Qatilləri/Morilci cvetne lune/Crimele din Osage County: Bani însângerați/ყვავილის მთვარის მკვლელები/Lillekuu tapjad/किलर्स ऑफ़ द फ़्लावर मून,2023,Crime/History/Drama,Martin Scorsese,Leonardo DiCaprio/Robert De Niro/Lily Gladstone/Jesse Plemons/Tantoo Cardinal/John Lithgow/Brendan Fraser/Cara Jade Myers/JaNae Collins/Jillian Dion/Jason Isbell/William Belleau/Louis Cancelmi/Scott Shepherd/Everett Waller/Tahlee Redcorn/Yancey Red Corn/Tatanka Means/Tommy Schultz/Sturgill Simpson/Ty Mitchell/Gary Basaraba/Charlie Musselwhite/Pat Healy/Steve Witting/Steve Routman/Gene Jones/Michael Abbott Jr./J.C. MacKenzie/Jack White/Larry Sellers/Barry Corbin/Gabriel Casdorph/Wally Welch/James Roman Dailey Jr./Christopher Cote/Randy Houser/Moe Headrick/Pete Yorn/Margaret Shannon-Sisk/Moira Redcorn/Chase Parker/Jarad Looper/John Gibbs/Jerry Logsdon/Jacob Lux/Xavier Toehay/Mike Cook/Katherine Willis/Delani Chambers/Zachary Hokeah/Talon Satepauhoodle/Chance Rush/Dana Daylight/Mahada Sanders/Jennifer Rader/Ben Hall/John Q. Wilson/Beau Smith/Victor McCay/Nathalie Standingcloud/Jay Paulson/Marvin E. Stepson Jr./Tracey Ann Moore/Easton Wade Yellowfish/Reignen Yellowfish/Candice Costello/Father Chris Daigle/Jerry Wolf/Addie Roanhorse/Justin France/Erica Pretty Eagle Moore/Mason Cunningham/Norma Jean/Elisha Pratt/Desireee Storm Brave/Margaret Gray/Christopher Hill/Dolan Wilson/Jackie Wyatt/Rayna Gellert/Nokosee Fields/Kieran Kane/Lucas Ross/Elijah Cemp Ragsdale/Vanessa Rose Pham/Terry Allen/Jo Harvey Allen/Sarah Spurger/Joshua Close/Elden Henson/Kinsleigh McNac/Roanin Davis/David Fields/Anthony J. Harvey/Stephen Berkman/Joseph Spinelli/William Alyn Hill/Blaine Hall/Brent Langdon/Leland Prater/DJ Whited/Elizabeth Waller/Jessica Harjo/Joey Oglesby/Alexis Ann/Gary S. Pratt/Nathaniel Arcand/Lee Eddy/Kristin Keith/Bravery Nowlin/Edward Gray Sr./Angela Pratt/Henry Amos Gray/Samuel Gray/Edward Gray Jr./Mamie Cozad/Shonagh Smith/Joel Tallchief Lemon/Richard Lookout RulingHisSun/Brett Bower/Garrison Panzer/River Rhoades/Zack T. Morris/Harrison Shackelford/Alexis Waller/Mark Landon Smith/Tom Ashmore/Myron F. Red Eagle/Dolores Marie Goodeagle/Matt Tolentino/Johnny Baier/Gregory Fallis/Patrick Bubert/TJ Muller/Will Reardon-Anderson/Peter Reardon-Anderson/Kyle Dillingham/Jacob Johnson/Jeffrey Stevenson/Clint Rohr/D. Reride Smith/Samuel French/James Healy Jr./Jeremy Goodvoice/Ron McMahan/Seth Buckminster/Penny Potts/Melissa Tiger/Karen Garlitz/Bronson Redeagle/Jenny Paige Lynn/David Born/Mary Buss/Ted Welch/Carl Palmer/Tanner Brantley/Jezy Gray/Steve Eastin/Joe Chrest/Brian Shoop/James Carroll/Lux Britni Malaske/Adam Washington/Larry Jack Dotson/Larry Fessenden/Welker White/Martin Scorsese/Marko Costanzo/Nicholas White/Rob Fisher/Vince Giordano/Paul Woodiel/Andy Stein/Sam Bardfeld/Joe Boga/Jon-Erik Kellso/Jim Fryer/Marc Phaneuf/Mark Lopeman/Chris Byars/Vinny Raniolo/Paul Wells/Peter Yarin/Scott George/Kenneth Bighorse Jr./Vann Bighorse/Anna L. Bighorse/Mason Bighorse/Norris Bighorse/Scott Bighorse/Paul Bighorse/Taveah Ann George/Wahwastoas J. Jones/Dobbin Monoessy Knifechief/Julia Lookout/Jennifer Moses/Francis Pipestem Jr./Michael Paul Pahsetopah/Silas Satepauhoodle/Cherylyn Oberly Satepauhoodle/Charisse Satepauhoodle/Lynette Satepauhoodle/John Shaw/Angela Toineeta Satepauhoodle/Alexandria Toineeta/Ed Yellowfish/Danny Frost/Eric Parkinson/Craig 'Radio Man' Castaldo,"When oil is discovered in 1920s Oklahoma under Osage Nation land, the Osage people are murdered one by one—until the FBI steps in to unravel the mystery.",206,4.0,5,1076051,https://letterboxd.com/film/killers-of-the-flower-moon/,https://a.ltrbxd.com/resized/film-poster/3/9/8/0/0/9/398009-killers-of-the-flower-moon-0-230-0-345-crop.jpg?v=49b577149d,https://a.ltrbxd.com/resized/sm/upload/wt/7t/d0/vk/kotfm-1200-1200-675-675-crop-000000.jpg?v=1189ce14d7,Success
tt0054215,Psycho,Psycho/Alfred Hitchcock's Psycho/Психоз/Психо/사이코/Ψυχώ/精神病患者/Խելագառ/Փսիխի/觸目驚心/驚魂記/Psicosis/Psicosis de Alfred Hitchcock/Psixo/Psychose/Psicose/Psiho/Psühho/Psyko/साइको/روانی/פסיכו/Psyco/サイコ/Psichopatas/Psychoza/Psico/Pshihoză/싸이코/Psicosi/Sapık/Wimpy/Tâm Thần Hoảng Loạn/المختل/ფსიქო/ไซโค/惊魂记/Psihoza,1960,Mystery/Thriller/Horror,Alfred Hitchcock,Anthony Perkins/Janet Leigh/Vera Miles/John Gavin/Martin Balsam/John McIntire/Simon Oakland/Frank Albertson/Patricia Hitchcock/Vaughn Taylor/Lurene Tuttle/John Anderson/Mort Mills/Fletcher Allen/Walter Bacon/Kit Carson/Francis De Sales/George Dockstader/George Eldredge/Harper Flaherty/Sam Flint/Virginia Gregg/Alfred Hitchcock/Paul Jasmin/Lee Kass/Frank Killmond/Ted Knight/Pat McCaffrie/Hans Moebus/Jeanette Nolan/Lillian O'Malley/Robert Osborne/Fred Scheiwiller/Helen Wallace,"When larcenous real estate clerk Marion Crane goes on the lam with a wad of cash and hopes of starting a new life, she ends up at the notorious Bates Motel, where manager Norman Bates cares for his housebound mother.",109,4.3,5,1126828,https://letterboxd.com/film/psycho/,https://a.ltrbxd.com/resized/film-poster/5/1/5/7/8/51578-psycho-0-230-0-345-crop.jpg?v=7250c49dcd,https://a.ltrbxd.com/resized/sm/upload/0o/2e/y3/39/psycho-1200-1200-675-675-crop-000000.jpg?v=f3bb2c1d1d,Success
tt26584495,Companion,Companion/Compañera Perfecta/完美伴侶/La acompañante/חברה מושלמת/Ուղեկից/Companion - Die perfekte Begleitung/Кампаньён/Acompanhante Perfeita/Pratnja/Kaaslane/Társ/Palydovė/Towarzysz/Пратња/Kusursuz Arkadaş/Компаньйон/Kẻ Đồng Hành/Shoqja/Compañera perfecta/컴패니언/คอมแพเนียน/Společník/Sopotnica/Компаньон/Compagnon/完美伴侣/Спътници/Spoločník/همنشین/Kompanyon/قرين/コンパニオン/კომპანიონი,2025,Thriller/Science Fiction/Horror,Drew Hancock,Sophie Thatcher/Jack Quaid/Lukas Gage/Megan Suri/Harvey Guillén/Rupert Friend/Jaboukie Young-White/Matthew J. McCarthy/Marc Menchaca/Woody Fu/Ashley Lambert,"During a weekend getaway at a secluded lakeside estate, a group of friends finds themselves entangled in a web of secrets, deception, and advanced technology. As tensions rise and loyalties are tested, they uncover unsettling truths about themselves and the world around them.",97,3.4,5,1120674,https://letterboxd.com/film/companion-2025/,https://a.ltrbxd.com/resized/film-poster/9/7/7/1/7/2/977172-companion-2025-0-230-0-345-crop.jpg?v=66c5c946ec,https://a.ltrbxd.com/resized/alternative-backdrop/9/7/7/1/7/2/tmdb/3KjdRYgPC5o12NWNL0PaBmsBDz8-1200-1200-675-675-crop-000000.jpg?v=ff13eb645f,Success
tt0110357,The Lion King,The Lion King/Король Лев/Ο Βασιλιάς των Λιονταριών/狮子王/獅子王/Der König der Löwen/Leijonakuningas/Il re leone/Az Oroszlánkirály/Løvernes konge/O Rei Leão/Lejonkungen/Løvenes konge/Le Roi lion/De Leeuwenkoning/الأسد الملك/Lví král/El rey león/Aslan Kral/Król Lew/מלך האריות/Konungur ljónanna/Краљ лавова/ライオン・キング/Regele Leu/Цар Лъв/라이온 킹/เดอะไลอ้อนคิง/Leví kráľ/Le Roi Lion/شیر شاه/Kralj lavova/Liūtas karalius/Qirol Sher/Lõvikuningas/Levji kralj/Karalis Lauva/Vua Sư Tử/მეფე ლომი/El rei lleó,1994,Animation/Drama/Fantasy/Adventure/Family,Roger Allers/Rob Minkoff,Matthew Broderick/Moira Kelly/Nathan Lane/Ernie Sabella/James Earl Jones/Jeremy Irons/Robert Guillaume/Rowan Atkinson/Jonathan Taylor Thomas/Niketa Calame-Harris/Whoopi Goldberg/Cheech Marin/Jim Cummings/Madge Sinclair/Zoe Leader/Frank Welker/Cathy Cavadini/Judi Durand/Daamen J. Krall/David McCharen/Mary Linda Phillips/Phil Proctor/David J. Randolph/Brian Tochi/Jason Weaver,"Young lion prince Simba, eager to one day become king of the Pride Lands, grows up under the watchful eye of his father Mufasa; all the while his villainous uncle Scar conspires to take the throne for himself. Amid betrayal and tragedy, Simba must confront his past and find his rightful place in the Circle of Life.",89,4.2,5,1685460,https://letterboxd.com/film/the-lion-king/,https://a.ltrbxd.com/resized/sm/upload/lz/96/yu/mf/ztuEReeV6ofpU1HxUV9AsR6aLoe-0-230-0-345-crop.jpg?v=47499379fa,https://a.ltrbxd.com/resized/sm/upload/nu/1q/bf/iz/lion%20king-1200-1200-675-675-crop-000000.jpg?v=e25d884213,Success
tt0373889,Harry Potter and the Order of the Phoenix,Harry Potter and the Order of the Phoenix/Harry Potter och Fenixorden/Harry Potter E L'ordine della Fenice/Harry Potter og Føniksordenen/Harry Potter i Zakon Feniksa/Harry Potter e a Ordem da Fênix/해리포터와 불사조 기사단/Гарри Поттер и Орден Феникса/ハリーポッターと不死鳥の騎士団/Harijs Poters un Fēniksa Ordenis/הרי פותר ומסדר עוף החול/Harry Potter y la Orden del Fénix/Harry Potter ja Fööniksi Ordu/哈利·波特与凤凰社/Harry Potter và Hội Phượng Hoàng/Harry Potter und der Orden des Phönix/แฮร์รี่ พอตเตอร์กับภาคีนกฟีนิกซ์/هاري بوتر وجماعة العنقاء/Harry Potter et l'Ordre du Phénix/Հարրի Փոթերը և Փյունիկի միաբանությունը/Harri Potter və Simurq Ordeni/Harry Potter i Red Feniksa/Harry Potter i l'orde del Fènix/Harry Potter og Fønixordenen/Hari Poter kaj la Ordeno de la Fenikso/Harry Potter eta Fenixaren Ordena/Harry Potter e a Orde do Fénix/Haris Poteris ir Fenikso Brolija/Harry Potter és a Főnix Rendje/Harry Potter en de Orde van de Feniks/Harry Potter va Feniks Jamiyati/Harry Potter dhe Urdhri i Feniksit/Harry Potter și Ordinul Phoenix/Harry Potter in Feniksov Red/Harry Potter a Fénixov Rád/Harry Potter ja Feeniksin Kilta/Harry Potter ve Zümrüdüanka Yoldaşlığı/Harry Potter a Fénixův Řád/Harry Potter og Fönixreglan/Haris Puoteris ė Feniksa Bruolėjė/Гары Потэр і Ордэн Фенікса/Ο Χάρι Πότερ και το Τάγμα του Φοίνικα/Гарри Поттер жана Феникс ордени/Хари Потър и Орденът на феникса/Харри Поттер ба Галт шувууны бүлгэм/Хари Потер и Редот на фениксот/Хари Потер и Ред феникса/Гаррі Поттер та Орден Фенікса/Гарри Поттер тата Феникс орденӗ/Хәрри Поттер және Самұрық Ордені/ہیری پوٹر اور ققنس کا گروہ/هری پاتر و محفل ققنوس/هارى بوتر وجماعه العنقاء/ہیری پوٹر اینڈ دی آرڈر اف فینیکس/ہیری پوٹر تہٕ پھینِک سٕنٛز جماعت/हैरी पॉटर और मायापंछी का समूह/हॅरी पॉटर अँड द ऑर्डर ऑफ द फिनिक्स/ਹੈਰੀ ਪੌਟਰ ਐਂਡ ਦ ਔਰਡਰ ਔਫ਼ ਦ ਫ਼ੀਨਿਕਸ/ஆரி பாட்டர் அண்டு த ஆர்டர் ஆப் த பீனிக்சு/ഹാരി പോട്ടർ ആന്റ് ദ ഓർഡർ ഓഫ് ദ ഫീനിക്സ്/ჰარი პოტერი დო ფენიქსიშ ორდენი/ჰარი პოტერი და ფენიქსის ორდენი/해리 포터 5/Harry Potter 5/Harry Potter e l'ordine della fenice/Harry Potter e a Ordem da Fénix/Harry Potter és a Főnix rendje/Harry Potter a Fénixov rád/Harry Potter a Fénixův řád/Harry Potter ja Feeniksin kilta/แฮร์รี่ พอตเตอร์ กับ ภาคีนกฟีนิกซ์/הארי פוטר ומסדר עוף החול/ハリー・ポッターと不死鳥の騎士団/해리 포터와 불사조 기사단/哈利波特：鳳凰會的密令/Harry Potter y la orden del Fénix/Harry Potter và Mệnh Lệnh Phượng Hoàng/Harijs Poters un Fēniksa ordenis/Haris Poteris ir Fenikso brolija/Harry Potter in Feniksov red/Harry Potter i Red feniksa/هاري بوتر و جماعة العنقاء/हैरी पौटर फ़ीनिक्स की फौज,2007,Adventure/Fantasy,David Yates,Daniel Radcliffe/Rupert Grint/Emma Watson/Imelda Staunton/Helena Bonham Carter/Robbie Coltrane/Gary Oldman/Ralph Fiennes/Michael Gambon/Alan Rickman/Richard Griffiths/Brendan Gleeson/Jason Isaacs/Evanna Lynch/Katie Leung/Warwick Davis/Fiona Shaw/Maggie Smith/David Thewlis/Emma Thompson/Julie Walters/David Bradley/Tom Felton/Robert Hardy/George Harris/Natalia Tena/Mark Williams/Harry Melling/Jason Boyd/Richard Macklin/Kathryn Hunter/Miles Jupp/Jessica Hynes/Adrian Rawlins/Geraldine Somerville/Peter Cartwright/Brigitte Millar/Timothy Bateson/James Phelps/Oliver Phelps/Bonnie Wright/Jamie Wolpert/Nicholas Blane/Daisy Haggard/Chris Rankin/Sian Thomas/Jamie Waylett/Josh Herdman/Matthew Lewis/Ryan Nelson/William Melling/Apple Brook/Devon Murray/Alfred Enoch/Afshan Azad/Shefali Chowdhury/Jim McManus/Nick Shirm/Sam Beazley/John Atterbury/Arben Bajraktaraj/Richard Leaf/Tony Maudsley/Alec Hopkins/Robbie Jarvis/James Walters/Charles Hughes/James Utechin/Jason Piper/Michael Wildman/Richard Cubison/Peter Best/Tav MacDougall/Richard Trinder/Nathan Clarke/David Heyman/Cliff Lanning/James Payton/Christopher Rithin/Lauren Shotton/Timothy Spall/Lisa Wood/Saskia Strallen/Kevin Hudson,"Returning for his fifth year of study at Hogwarts, Harry is stunned to find that his warnings about the return of Lord Voldemort have been ignored. Left with no choice, Harry takes matters into his own hands, training a small group of students to defend themselves against the dark arts.",138,3.7,5,1649301,https://letterboxd.com/film/harry-potter-and-the-order-of-the-phoenix/,https://a.ltrbxd.com/resized/sm/upload/wd/w4/n0/yj/g6n8G0xPnBVUIKKK41sNmbZB5h4-0-230-0-345-crop.jpg?v=57af08b652,https://a.ltrbxd.com/resized/sm/upload/z2/u4/ow/ba/harry-potter-order-phoenix-80-1200-1200-675-675-crop-000000.jpg?v=a3d0c19bdd,Success
tt2911666,John Wick,John Wick/John Wick Otro Día Para Matar/疾速追杀1/John Wick: Chapter 1/John Wick 1/疾速特攻/John Wick Chapitre 1/De Volta ao Jogo/John Wick 1 - De Volta Ao Jogo/ג'ון וויק: חלק 1/ジョン・ウィック/Джон Вік/Scorn/Ջոն Ուիք/Джон Уик/John Wick (Otro día para matar)/疾速追杀/ג'ון וויק/존 윅/จอห์น วิค : แรงกว่านรก/Джон Уік/John Wick - De Volta ao Jogo/John Wick: Otro Día para Matar/捍衛任務/Џон Вик/Sát Thủ John Wick/Džons Viks/Johano Uiko/Džonas Vikas/殺神John Wick/Jon Uik/جان ویک/ჯონ უიკი/جون ويك,2014,Action/Thriller,Chad Stahelski,Keanu Reeves/Michael Nyqvist/Alfie Allen/Willem Dafoe/Dean Winters/Adrianne Palicki/Omer Barnea/Toby Leonard Moore/Daniel Bernhardt/Bridget Moynahan/John Leguizamo/Ian McShane/Bridget Regan/Lance Reddick/Keith Jardine/Tait Fletcher/Kazy Tauginas/Alexander Frekey/Thomas Sadoski/Randall Duk Kim/David Patrick Kelly/Clarke Peters/Kevin Nash/Gameela Wright/Vladislav Koulikov/Munro M. Bonnell/Patricia Squire/Vladimir Troitsky/Matt McColm/Scott Tixier/Carolyn Blair/Samantha Crawford/Nadia Kay/Natalia Kiriya/Tommy Bayiokos/J.J. Perry/Dennis Keiffer/Alex Ziwak/Erik Martin/Elizabeth Saint/Marija Skangale/Paugh Shadow,Ex-hitman John Wick comes out of retirement to track down the gangsters that took everything from him.,101,3.8,5,1538595,https://letterboxd.com/film/john-wick/,https://a.ltrbxd.com/resized/film-poster/1/7/2/0/7/6/172076-john-wick-0-230-0-345-crop.jpg?v=e3c8c69b11,https://a.ltrbxd.com/resized/sm/upload/wp/bs/m0/17/john-wick-1200-1200-675-675-crop-000000.jpg?v=a0df875fb4,Success
tt0298148,Shrek 2,Shrek 2/史力加2/Šrek 2/Srek 2/Shiroq 2/怪物史瑞克2/Shrek II/シェレック２/Gã Chằn Tinh Tốt Bụng 2/怪物史莱克2/Shrek 2 - Der tollkühne Held kehrt zurück/Шрэк 2/Shrek 2./שרק 2/Şrek 2/Σρεκ 2/슈렉 2/シュレック2/Шрек 2/เชร็ค 2/史瑞克2/شرک ۲/Šrekas 2/شريك 2/Šreks 2/史力加 2/შრეკი 2,2004,Family/Adventure/Comedy/Animation/Fantasy,Andrew Adamson/Kelly Asbury,Mike Myers/Eddie Murphy/Cameron Diaz/Julie Andrews/Antonio Banderas/John Cleese/Rupert Everett/Jennifer Saunders/Aron Warner/Kelly Asbury/Cody Cameron/Conrad Vernon/Christopher Knights/David P. Smith/Mark Moseley/Kelly Cooney Cilella/Wendy Bilanski/Larry King/Guillaume Aretos/Chris Miller/Latifa Ouaou/Alina Phelan/Erika Thomas/Joan Rivers/Andrew Adamson/Jonathan Ross,"Shrek, Fiona, and Donkey set off to Far, Far Away to meet Fiona’s mother and father, the Queen and King. But not everyone is happily ever after. Shrek and the King find it difficult to get along, and there’s tension in the marriage. The Fairy Godmother discovers that Fiona has married Shrek instead of her son Prince Charming and plots to destroy their marriage.",92,4.1,5,1579968,https://letterboxd.com/film/shrek-2/,https://a.ltrbxd.com/resized/sm/upload/g4/4m/0c/6s/rD8SvOTCCJ2VIpIV7GUwUKD1Kzc-0-230-0-345-crop.jpg?v=e780d1b7d3,https://a.ltrbxd.com/resized/sm/upload/b2/i4/ji/hg/shrek-2-1200-1200-675-675-crop-000000.jpg?v=5cbec1e1bc,Success
tt0083658,Blade Runner,Blade Runner/Dangerous Days/Той/хто біжить по лез/Blade Runner - Metropolis 2020/Blade Runner (International Cut)/Blade Runner (Final Cut)/Blade Runner (The Final Cut)/o Caçador de Androides/銀翼殺手/ブレードランナー/Blade Runner Director's Cut/블레이드 러너/블레이드러너/서기 2019년/서기 2019 블레이드 러너/ブレードランナー：1982/2020/Blade Runner - The Final Cut/Blade Runner: The Final Cut/Blade Runner - Remasterizado/Bıçak Sırtı/Łowca Androidów/銀翼殺手 終極版/블레이드 러너: 파이널 컷/블레이드 러너: 파이널컷/Der Blade Runner/Бегущий по лезвию/Blade Runner: Perigo Iminente/Szárnyas fejvadász/银翼杀手/Łowca androidów/בלייד ראנר/Блейд Рънър/Μπλέηντ Ράννερ: Ομάδες Εξόντωσης/Vânătorul de recompense/Blade Runner: O Caçador de Andróides/хто біжить по лезу/Iztrebljevalec/Bėgantis skustuvo ašmenimis/Блејд ранер: Истребљивач/სამართებელზე მორბენალი/Ülgücün üzəri ilə qaçan/Pa asmeni skrejošais/Istrebljivač/เบลด รันเนอร์/Бегчы па лязе/Tội Phạm Người Máy/بليد رانر/بلید رانر,1982,Thriller/Drama/Science Fiction,Ridley Scott,Harrison Ford/Rutger Hauer/Sean Young/Edward James Olmos/M. Emmet Walsh/Daryl Hannah/William Sanderson/Brion James/Joe Turkel/Joanna Cassidy/James Hong/Morgan Paull/Kevin Thompson/John Edward Allen/Hy Pyke/Kimiko Hiroshige/Bob Okazaki/Carolyn DeMirjian/Ben Astar/Dawna Lee Heising/Alexis Rhee/Judith Burnett/Leo Gorcey Jr./Sharon Hesky/Kelly Hine/Tom Hutchinson/Charles Knapp/Rose Mascari/Jiro Okazaki/Steve Pope/Robert Reiter,"In the smog-choked dystopian Los Angeles of 2019, blade runner Rick Deckard is called out of retirement to terminate a quartet of replicants who have escaped to Earth seeking their creator for a way to extend their short life spans.",118,4.1,5,1214134,https://letterboxd.com/film/blade-runner/,https://a.ltrbxd.com/resized/sm/upload/85/io/38/dz/vfzE3pjE5G7G7kcZWrA3fnbZo7V-0-230-0-345-crop.jpg?v=0d5de70f0d,https://a.ltrbxd.com/resized/sm/upload/ne/pc/iq/wf/blade-runner-1200-1200-675-675-crop-000000.jpg?v=b663a63f34,Success
tt0107688,The Nightmare Before Christmas,The Nightmare Before Christmas/Tim Burton's The Nightmare Before Christmas/팀 버튼의 크리스마스 악몽/Noční můra předvánoční/L'étrange noël de M. Jack/The Nightmare Before Christmas 3D/क्रिसमस से पहले दुःस्वप्न/Ukradené Vánoce Tima Burtona/טים ברטון הסיוט שלפני חג המולד/Et førjulsmareritt/Đêm Kinh Hoàng Trước Giáng Sinh/Pesadilla antes de Navidad/The Special Edition of the Nightmare Before Christmas/Jack and Sally the Nightmare Before Christmas/Jack og Sally Martröðin Fyrir Jólin/Jack und Sallys Albtraum vor Weihnachten/L'étrange Monde de Jack et Sally/Jack och Sallys Mardröm Före Jul av Tim Burton/Χριστουγεννιάτικος Εφιάλτης/Le Noël Étrange de Jack and Sally - Un film de Tim Burton/Tim Burton presenta - Il Natale Dell'orrore di Jack e Sally/Makthi Para Krishtlindjeve - Një Film i: Tim Burton/Jack och Sallys Mardröm Före Jul/O Estranho Mundo de Jack/Nightmare Before Christmas/L'Étrange Noël de monsieur Jack/Кошмар перед Рождеством/Noel Gecesi Kabusu/Karácsonyi lidércnyomás/圣诞夜惊魂/Ukradené Vánoce/Jack i Sally Koszmar przed świętami/Predvianočná nočná mora/ナイトメアー・ビフォア・クリスマス/הסיוט שלפני חג המולד/Τζακ και Σάλι Ο εφιάλτης πριν από τα Χριστούγεννα/O Estranho Natal de Jack e Sally/Coșmar înainte de Crăciun/Жах перед Різдвом/Кошмарът преди Коледа/El extraño mundo de Jack/Предбожићна мора/聖誕夜驚魂/L'Étrange Noël de Monsieur Jack/کابوس پیش از کریسمس/Košmaras prieš Kalėdas/Predbožična mora/Predbožićna noćna mora/Jack og Sallys Mareritt Før Jul/Malson abans de Nadal/ฝันร้ายฝันอัศจรรย์ ก่อนวันคริสต์มาส/怪誕城之夜/كابوس قبل عيد الميلاد/Murgs pirms Ziemassvētkiem/საშინელება შობის წინ/Jõulueelne õuduslugu/Makthi Para Krishtlindjeve,1993,Family/Animation/Fantasy,Henry Selick,Danny Elfman/Chris Sarandon/Catherine O'Hara/William Hickey/Glenn Shadix/Paul Reubens/Ken Page/Edward Ivory/Susan McBride/Debi Durst/Greg Proops/Kerry Katz/Randy Crenshaw/Sherwood Ball/Carmen Twillie/Glenn Walters/Mia Brown/L. Peter Callender/Ann Fraser/Jennifer Levey/Jesse McClurg/John Morris/Robert Olague/Bobbi Page/Elena Praskin/Trampas Warman/Judi Durand/Doris Hess/Daamen J. Krall/Christina MacGregor/David McCharen/Gary Raff/David J. Randolph/Gary Schwartz/Tim Burton/Joe Ranft,"Tired of scaring humans every October 31 with the same old bag of tricks, Jack Skellington, the spindly king of Halloween Town, kidnaps Santa Claus and plans to deliver shrunken heads and other ghoulish gifts to children on Christmas morning. But as Christmas approaches, Jack’s rag-doll girlfriend, Sally, tries to foil his misguided plans.",76,4.0,5,1447609,https://letterboxd.com/film/the-nightmare-before-christmas/,https://a.ltrbxd.com/resized/film-poster/4/7/1/1/9/47119-the-nightmare-before-christmas-0-230-0-345-crop.jpg?v=cc72c8b470,https://a.ltrbxd.com/resized/sm/upload/ng/yt/5d/34/nightmare-before-christmas-1200-1200-675-675-crop-000000.jpg?v=50c6eea4ee,Success
