imdb_id,original_title,alternative_titles,release_year,genres,directors,actors,summary,length,rating,rating_max,rating_num,detail_url,poster_url,backdrop_url,status
tt26446278,Le Comte de Monte-Cristo,The Count of Monte Cristo/O Conde de Monte Cristo/کنت مونت کریستو/Граф Монте Кристо/El Conde de Montecristo/Der Graf von Monte Christo/Ο κόμης Μόντε Κρίστο/Monte Cristo grófja/Граф Монте-Кристо/Grāfs Monte-Kristo/El conde de Montecristo/Hrabia Monte Christo/Contele de Monte-Cristo/Гроф Монте Кристо/Monte Cristo Kontu/Граф Монте-Крісто/基督山伯爵/أمير مونت كريستو/Il conte di Montecristo/Hrabě Monte Christo/몬테크리스토 백작/Gróf Monte Cristo/გრაფი მონტე-კრისტო/Ο Κόμης Μόντε Κρίστο/基度山恩仇記新傳/Bá tước Monte-Cristo/הרוזן ממונטה קריסטו/Grof Monte Cristo/Grof Monte-Cristo/Grafas Montekristas/Greven af Monte Cristo/El comte de Montecristo,2024,Drama/Action/Adventure,Alexandre de La Patellière/Matthieu Delaporte,Pierre Niney/Bastien Bouillon/Anaïs Demoustier/Laurent Lafitte/Pierfrancesco Favino/Patrick Mille/Vassili Schneider/Julien de Saint Jean/Anamaria Vartolomei/Julie de Bona/Adèle Simphal/Stéphane Varupenne/Marie Narbonne/Bruno Raffaelli/Abde Maziane/Amaya Ducellier/Oscar Lesage/Joachim Simon/Françoise Gazio/Axel Baille/Lily Dupont/Olivier Le Montagner/Jérémie Covillault/Bernard Blancan/Graziella Delerm/Xavier de Guillebon/Clémentine Baert/Florence Muller/Serge Bagdassarian/Jean-Louis Tribes/Laurent Dassault,"Edmond Dantes becomes the target of a sinister plot and is arrested on his wedding day for a crime he did not commit. After 14 years in the island prison of Château d’If, he manages a daring escape. Now rich beyond his dreams, he assumes the identity of the Count of Monte-Cristo and exacts his revenge on the three men who betrayed him.",178,4.1,5,273927,https://letterboxd.com/film/the-count-of-monte-cristo-2024/,https://a.ltrbxd.com/resized/film-poster/9/7/7/8/3/5/977835-the-count-of-monte-cristo-2024-0-230-0-345-crop.jpg?v=f72dd77674,https://a.ltrbxd.com/resized/sm/upload/5g/ta/8j/jr/oMAflNvZXokVuOaSQAqw0HnKI24-1200-1200-675-675-crop-000000.jpg?v=3cb7da732d,Success
tt0486576,Fantastic Four: Rise of the Silver Surfer,Fantastic Four: Rise of the Silver Surfer/Fantastic Four: The Next Chapter/Los cuatro fantásticos y el deslizador de plata/Fantastic Four 2: Rise of the Silver Surfer/Fantastic Four 2/Fantastic Four and the Silver Surfer/Los 4 Fantásticos 2 y Silver Surfer/Фантастична Четвірка 2: Вторгнення Срібного серфера/Los cuatro fantásticos y Silver Surfer/Fantastic Four 2 - Rise of the Silver Surfer/4: Rise of the Silver Surfer/Les Quatre Fantastiques et le Surfer d'Argent/چهار شگفت‌انگیز ۲: قیام موج‌سوار نقره‌ای/چهار شگفت‌انگیز ۲/Bộ Tứ Siêu Đẳng 2: Sứ Giả Bạc/神奇4俠：銀魔現身/神奇四侠2：银影侠现身/Фантастическая Четверка: Вторжение Серебряного Серфера/Fantastic Four：Rise Of The Silver Surfer/Cei patru fantastici: Ascensiunea lui Silver Surfer/Fantastic Four - Rise of the Silver Surfer/Les 4 fantastiques et le Surfer d'argent/I Fantastici 4 e Silver Surfer/De Fantastiske Fire 2/Фантастическая Четвёрка: Вторжение Серебряного Сёрфера/Fantastik Dörtlü: Gümüş Sörfçü'nün Yükselişi/Los 4 fantásticos y Silver Surfer/A Fantasztikus Négyes és az Ezüst Utazó/Fantastic Four: Hopeasurffari/Quarteto Fantástico e o Surfista Prateado/Fantastická čtyřka a Silver Surfer/Fantastyczna Czwórka. Narodziny Srebrnego Surfera/神奇四侠2/ארבעת המופלאים: עלייתו של הגולש הכסוף/สี่พลังคนกายสิทธิ์ 2 กำเนิดซิลเวอร์ เซิร์ฟเฟอร์/Фантастична четворка: успон Сребрног летача/ファンタスティック・フォー：銀河の危機/Фантастичната четворка и Сребърния сърфист/Fantastic Four: Η Άνοδος του Silver Surfer/Fantastická štvorka a Silver Surfer/Cei 4 Fantastici: Ascensiunea lui Silver Surfer/판타스틱 4: 실버 서퍼의 위협/Els Quatre Fantàstics i en Silver Surfer/驚奇4超人：銀色衝浪手現身/Los 4 Fantásticos y Silver Surfer/Fantastiskais četrinieks un Sudraba Sērfotājs/Фантастична четвірка: Вторгнення Срібного серфера/چهار شگفت‌انگیز: قیام موج‌سوار نقره‌ای/Les 4 Fantastiques et le Surfer d'Argent/Bộ Tứ Siêu Đẳng: Sứ Giả Bạc/Fantastična četvorka: Dolazak srebrnog letača/Fantastiškas ketvertas: Sidabrinio banglentininko iškilimas/ფანტასტიკური ოთხეული: ვერცხლის სერფერის აღზევება,2007,Action/Science Fiction/Adventure,Tim Story,Ioan Gruffudd/Jessica Alba/Chris Evans/Michael Chiklis/Julian McMahon/Laurence Fishburne/Doug Jones/Kerry Washington/Andre Braugher/Beau Garrett/Brian Posehn/Zach Grenier/Kenneth Welsh/Kevin McNulty/Andy Stahl/Debbie Timuss/Moneca Delain/Yan-Kay Crystal Lowe/Vanessa Lachey/Stan Lee/Gonzalo Menendez/Giuliana Rancic/Lauren Sánchez/Benjamin Ayres/Patricia Harras/Fareed Abdelhak/Dawn Chubai/Alicia Thorgrimsson/Valerie Tian/Jeanna Haddow/Ali Costigan/Suzanne Ristic/Michasha Armstrong/Ulla Friis/Nimet Kanji,"The Fantastic Four return to the big screen as a new and all powerful enemy threatens the Earth. The seemingly unstoppable ‘Silver Surfer’, but all is not what it seems and there are old and new enemies that pose a greater threat than the intrepid superheroes realize.",92,2.4,5,374950,https://letterboxd.com/film/fantastic-four-rise-of-the-silver-surfer/,https://a.ltrbxd.com/resized/film-poster/5/0/6/3/1/50631-fantastic-four-rise-of-the-silver-surfer-0-230-0-345-crop.jpg?v=2affd85087,https://a.ltrbxd.com/resized/sm/upload/us/me/rb/3l/fantastic-four-rise-silver-surfer-110-1200-1200-675-675-crop-000000.jpg?v=f216ef38eb,Success
tt0104257,A Few Good Men,A Few Good Men/Cuestion De Honor/Few Good Men/A/Uma Questão de Honra/义海雄风/Ludzie Honoru/어퓨굿맨/Algunos Hombres Buenos/Eine Frage der Ehre/Codice d'onore/Egy becsületbeli ügy/Birkaç İyi Adam/Des hommes d'honneur/Algunos hombres buenos/Несколько хороших парней/好人寥寥/På heder och samvete/Kunnian miehiä/Pár správných chlapů/Et spørgsmål om ære/Ζήτημα Τιμής/Неколико добрих људи/เทพบุตรเกียรติยศ/Oameni de onoare/בחורים טובים/Ludzie honoru/어 퓨 굿 맨/Questão de Honra/Zadnji dobri možje/Кілька хороших хлопців/ア・フュー・グッドメン/Доблестни мъже/軍官與魔鬼/Zopár správnych chlapov/義海雄風/Chỉ Vài Người Tốt/Geri vyrukai/Cuestión De Honor/چند مرد خوب/Malo dobrih ljudi/Alguns homes bons/რამოდენიმე კარგი ბიჭი/Et Spørsmål Om Ære,1992,Drama,Rob Reiner,Tom Cruise/Jack Nicholson/Demi Moore/Kevin Bacon/Kiefer Sutherland/Kevin Pollak/James Marshall/J. T. Walsh/Christopher Guest/J.A. Preston/Matt Craven/Wolfgang Bodison/Xander Berkeley/John M. Jackson/Noah Wyle/Cuba Gooding Jr./Lawrence Lowe/Joshua Malina/Oscar Jordan/John M. Mathews/Aaron Sorkin/Alex Wexo/Frank Cavestani/Jan Munroe/Ron Ostrow/Matthew Saks/Harry Caesar/Michael DeLorenzo/Geoffrey Nauffts/Arthur Senzy/Cameron Thor/David Bowe/Gene Whittington/Maud Winchester/Jack Serino,"When cocky military lawyer Lt. Daniel Kaffee and his co-counsel, Lt. Cmdr. JoAnne Galloway, are assigned to a murder case, they uncover a hazing ritual that could implicate high-ranking officials such as shady Col. Nathan Jessep.",138,4.0,5,251310,https://letterboxd.com/film/a-few-good-men/,https://a.ltrbxd.com/resized/sm/upload/dw/l7/qy/bb/WgWLwk55YaXFZdlMnPJTKlxGcz-0-230-0-345-crop.jpg?v=60ddf4aa47,https://a.ltrbxd.com/resized/sm/upload/gn/r5/sf/38/a-few-good-men-1200-1200-675-675-crop-000000.jpg?v=b67f0aaa41,Success
tt0119738,My Best Friend’s Wedding,My Best Friend’s Wedding/O gamos tou kalyterou mou filou/O gamos tou kaliterou mou filou/Die Hochzeit meines besten Freundes/Il matrimonio del mio migliore amico/Álljon meg a nászmenet/Le Mariage de mon meilleur ami/La boda de mi mejor amigo/O Casamento do Meu Melhor Amigo/Свадьба лучшего друга/我最好朋友的婚礼/Ο γάμος του καλύτερού μου φίλου/เจอกลเกลอ วิวาห์อลเวง/Svatba mého nejlepšího přítele/Min bäste väns bröllop/Min bedste vens bryllup/내 남자친구의 결혼식/החתונה של החבר שלי/新娘不是我/Сватбата на най-добрия ми приятел/Mój chłopak się żeni/En İyi Arkadaşım Evleniyor/ベスト・フレンズ・ウェディング/Весілля найкращого друга﻿/La boda del meu millor amic/Mano geriausio draugo vestuvės/Kuka sanoo tahdon/Svadba môjho najlepšieho priateľa/Moj najbolji prijatelj se ženi/真的想嫁你/Đám Cưới Bạn Thân/ჩემი საუკეთესო მეგობრის ქორწილი/Min beste venns bryllup,1997,Comedy/Romance,P.J. Hogan,Julia Roberts/Dermot Mulroney/Cameron Diaz/Rupert Everett/Philip Bosco/M. Emmet Walsh/Rachel Griffiths/Carrie Preston/Susan Sullivan/Christopher Masterson/Raci Alexander/Jennifer Garrett/Kelleia Sheerin/Bree Turner/Cassie Creasy/Lucina Paquet/Aida Baggio/Shirley Kelly/George Bozonelos/Loretta Paoletti/Joseph Sikora/Shale Marks/Phillip Ingram/Rose Abdoo/JoBe Cerny/Paul Giamatti/Charlie Trotter/Guillermo Téllez/Ned Schmidtke/Mark Swenson/Mara Casey/Tonray Ho/Michelle Hutchison/Robert Sutter/Charlotte Zucker/Susan Breslau/Burton Zucker/Sharon Haight/Nydia Rodriguez Terracina/Mike Bacarella/Larry Santori/Gene Janson/Kevin Michael Doyle/Scott Kuhagen/Sid Hillman/Norman Merrill/Renata Scott/Anh Duong/Harry Shearer/Jennifer McComb/Mary-Pat Green/Davenia McFadden/Jo Farkas/Chelcie Ross/Ray Uhler/Paul Adelstein/Stephanie Burton/Kathi Copeland/Amy Danles/Jerod Howard/Chris Lowe/Molly Murphy/Eric A. Pot/Dominic Paolo Testa/Robert Velo/Niko El Santo Zavero/Johnny White,"When she receives word that her longtime platonic pal Michael O’Neal is getting married to debutante Kimberly Wallace, food critic Julianne Potter realizes her true feelings for Michael – and sets out to sabotage the wedding.",105,3.2,5,272200,https://letterboxd.com/film/my-best-friends-wedding/,https://a.ltrbxd.com/resized/film-poster/4/7/5/5/0/47550-my-best-friend-s-wedding-0-230-0-345-crop.jpg?v=181f47401f,https://a.ltrbxd.com/resized/sm/upload/pf/d3/c0/ul/my%20best%20friends-1200-1200-675-675-crop-000000.jpg?v=8e1f322946,Success
tt0120265,طعم گيلاس,Taste of Cherry/Ta'm e guilass/Ta'me Gilas/Tame Gilas/체리향기/Le Goût de la cerise/Smaken av kirsebær/Le goût de la cerise/Il sapore della ciliegia/El sabor de las cerezas/Der Geschmack der Kirsche/Вкус вишни/Gosto de Cereja/체리 향기/Η Γεύση του Κερασιού/樱桃的滋味/Kirazın Tadı/Smak av körsbär/Вкусът на черешата/Gustul cireselor/De Smaak van Kersen/O Sabor da Cereja/櫻桃的滋味/Hương Vị Anh Đào/Smak wiśni/桜桃の味/Kirsikan maku/A cseresznye íze/Chuť třešní/Смак вишні/Trešnių skonis/טעם הדובדבן,1997,Drama,Abbas Kiarostami,Homayoun Ershadi/Abdolrahman Bagheri/Safar Ali Moradi/Mir Hossein Noori/Elham Imani/Afshin Khorshid Bakhtiari/Ahmad Ansari,"A middle-aged Tehranian man, Mr. Badii is intent on killing himself and seeks someone to bury him after his demise. Driving around the city, the seemingly well-to-do Badii meets with numerous people, including a Muslim student, asking them to take on the job, but initially he has little luck. Eventually, Badii finds a man who is up for the task because he needs the money, but his new associate soon tries to talk him out of committing suicide.",99,4.3,5,159467,https://letterboxd.com/film/taste-of-cherry/,https://a.ltrbxd.com/resized/film-poster/3/2/3/4/5/32345-taste-of-cherry-0-230-0-345-crop.jpg?v=64fada0a9a,https://a.ltrbxd.com/resized/sm/upload/p4/rv/0c/k5/taste-1200-1200-675-675-crop-000000.jpg?v=b0d08e59d8,Success
tt0300140,Lilja 4-ever,Lilya 4-ever/천상의 릴리아/Lilja 4-Ever/リリア フォーエバー/Lilya 4ever/Lilja forever (Lilja 4-ever)/永远的莉莉亚/Лиля навсегда/Λίλια για Πάντα/Daima Lilya/ליליה לנצח/Para Sempre Lilya/Лиля завинаги/Lilya 4-Ever/Lilija amžinai/Ліля назавжди/リリア 4-ever/Lilja/永遠的莉莉亞,2002,Drama/Crime,Lukas Moodysson,Oksana Akinshina/Artyom Bogucharsky/Ljubov Agapova/Liilia Šinkarjova/Elina Benenson/Pavel Ponomaryov/Tomasz Neuman/Anastasiya Bedredinova/Tõnu Kark/Nikolai Bentsler/Aleksander Dorosjkevitch/Yevgeni Gurov/Aleksandr Sokolenko/Margo Kostelina/Veronika Kovtun/Elena Yakovlena/Tamara Solodnikova/Nikolai Kütt/Oleg Rogatšov/Aleksandr Okunev/Herardo Contreras/Madis Kalmet/Bo Christer Hjelte/Sten Erici/Hermie Acereda/Gert Bondesson/Anders Brinning/Johan Edlund/Henryk Gwiazada/Rickard Mattila/Michael Merikan/Jeff Norman/Truls Rosén/Jacob Ryer/Farhad Sina/Johan Åkerblom/Jaanika/Olga,"In a struggling post-Soviet community, Lilya a teenage girl is abandoned when her mother moves to the United States with her boyfriend. Facing neglect and poverty, she meets Andrei, who offers her a job in Sweden, giving her hope for a better life — and a journey that will change everything.",109,4.2,5,163699,https://letterboxd.com/film/lilya-4-ever/,https://a.ltrbxd.com/resized/film-poster/4/4/8/0/7/44807-lilya-4-ever-0-230-0-345-crop.jpg?v=d54f518af6,https://a.ltrbxd.com/resized/sm/upload/e5/a7/6j/n9/lilja-1200-1200-675-675-crop-000000.jpg?v=d727c08dc4,Success
tt0116695,Jerry Maguire,Jerry Maguire/Jerry Maguire - elämä on peliä/Yeni bir baslangiç/ザ・エージェント：1996/Jerry Maguire - Spiel des Lebens/Yeni Bir Başlangıç/Τζέρι Μαγκουάιρ/Джерри Магуайер/Jerry Maguire - A Nagy hátraarc/Џери Мегвајер/甜心先生/Джери Магуайър/ג'רי מגוויר/제리 맥과이어/Jerry Maguire: A Grande Virada/ザ・エージェント/Джері Магуайер/征服情海/Džeris Magvairas/ჯერი მაგუაერი/seducción y desafío/Quản Lý và Người Tình/جری مگوایر/เจอร์รี่ แม็คไกวร์ เทพบุตรรักติดดิน/جَرِي مَقوايَر,1996,Comedy/Romance/Drama,Cameron Crowe,Tom Cruise/Renée Zellweger/Cuba Gooding Jr./Kelly Preston/Jerry O'Connell/Jay Mohr/Regina King/Bonnie Hunt/Jonathan Lipnicki/Todd Louiso/Mark Pellington/Jeremy Suarez/Jared Jussim/Benjamin Kimball Smith/Ingrid Beer/Jann Wenner/Nada Despotovich/Ali Wentworth/Aries Spears/Kelly Coffield Park/Alice Marie Crowe/Larina Adamson/Winnie Holzman/Diana Jordan/Susan Norfleet/Susan Pingleton/Cha Cha Sandoval-McMahon/Hynden Walch/Glenn Frey/Donal Logue/Tom Gallop/Beaumont Bacon/Lisa Amsterdam/Angela Goethals/Leslie Upson/Rick Johnson/Lightfield Lewis/Jerry Cantrell/Toby Huss/Drake Bell/Christine Cavanaugh/Russel Lunday/Eric Stoltz/Lamont Johnson/Brent Barry/Charlie Cronin/Theo Greenly/Rod Tate/Danny Rimmer/Michael James Johnson/Jordan Ross/Brandon Christianson/Jerry Ziesmer/Kirsten Krueger/Shannon Thornton/Luis Damian/Jesus Alberto Guzman/Juan Arnoldo Morales/Alberto Alfavo/Andrea Ferrell/Anthony Natale/David Ursin/Thomas J. Reilly/Reagan Gomez-Preston/Jim Moffatt/Leo Zick/Klair Bybee/Stan Sessoms/Gale Hillman/Heather Cheney/Dennis Fitzgerald/Lucy Liu/Stephanie Furst/Justina Vail Evans/Samantha Smith/Ivana Miličević/Lisa Rotondi/Lisa Stahl/Emily Procter/Amaryllis Borrego/Stacey A. Snyder/Lauren Parker/Lisa Ann Hadley/Kymberly Kalil/Alison Armitage/Rebecca Rigg/Golde Starger/Roy Firestone/Al Michaels/Dan Dierdorf/Frank Gifford/Mel Kiper/Jeffrey Lurie/Drew Rosenhaus/Richie Kotite/Tim McDonald/Mike Tirico/Wayne Fontes/Evelyn Fontes/Mike White/Johnnie Morton/Rick Mirer/Drew Bledsoe/Rob Moore/Ki-Jana Carter/Herman Moore/Art Monk/Troy Aikman/Katarina Witt/Dean Biasucci/Warren Moon/Kerry Collins/Erica Sorgi/Tom Friend/Dallas Malloy/Jim Irsay/Meg Irsay/Beau Bridges/Greg Bronson/Jacqueline Collen/Luanne Crawford/Joanna Daniels/Micki Duran/Mia Korf/Gina La Piana/Valerie Richards/Summer Sanders/June Saruwatari/Iva Franks-Singer/Carolyn Renee Smith/Lynnanne Zager/Kerrie Friend/Leigh Steinberg,"Jerry Maguire used to be a typical sports agent: willing to do just about anything he could to get the biggest possible contracts for his clients, plus a nice commission for himself. Then, one day, he suddenly has second thoughts about what he’s really doing. When he voices these doubts, he ends up losing his job and all of his clients, save Rod Tidwell, an egomaniacal football player.",139,3.6,5,258439,https://letterboxd.com/film/jerry-maguire/,https://a.ltrbxd.com/resized/film-poster/4/7/2/0/6/47206-jerry-maguire-0-230-0-345-crop.jpg?v=0f7ed523ed,https://a.ltrbxd.com/resized/sm/upload/jv/4a/f6/k1/DA27C6F8-DCD0-4B94-AE66-687F7D0A939C-1200-1200-675-675-crop-000000.jpg?v=e71d1dd36a,Success
tt0120912,Men in Black II,Men in Black II/MIB 2/MIB II/MIIB/Hombres de Negro 2/Lyudi v chornom 2/MIIB - Back in Black/Mŭzhe v cherno 2/Oi Andres me ta Mavra II/Ljudi u crnom 2/Lyudy v chornomu 2/MIIB: Hombres de negro II (Men in Black 2)/MIB - Homens de Preto 2/MIB - Homens de Negro II/黑超特警组2/Οι Άνδρες με τα Μαύρα II/Οι Άνδρες με τα Μαύρα 2/Men in Black 2/Οι Άντρες με τα Μαύρα 2/Οι Άντρες με τα Μαύρα II/Men In Black 2/MIB - Sötét zsaruk 2./Muži v černém 2/Men in black 2/Men in Black - Sötét zsaruk 2./Люди в чёрном 2/Siyah Giyen Adamlar 2/Hombres de negro II/Muži v černém II/MIIB – Miehet mustissa 2/Homens de Negro II/Muži v čiernom 2/Faceci w czerni II/黑衣人2/เอ็มไอบี หน่วยจารชนพิทักษ์จักรวาล 2/Мъже в черно 2/גברים בשחור 2/メン・イン・ブラック 2/Bărbații în negru II/맨 인 블랙 2/Люди в чорному 2/MIB - Homens de Preto II/Hommes en noir II/Људи у црном 2/MIB星際戰警2/Možje v črnem 2/Vyrai juodais drabužiais II/Homes de negre 2/黑超特警組 2/Mehed mustas 2/მამაკაცები შავებში II/Đặc Vụ Áo Đen 2/الرجال ذي الحلل السوداء II/مردان سیاه‌پوش ۲/विश्वरक्षों की वापसी,2002,Science Fiction/Comedy/Action,Barry Sonnenfeld,Tommy Lee Jones/Will Smith/Rip Torn/Lara Flynn Boyle/Johnny Knoxville/Rosario Dawson/Tony Shalhoub/Patrick Warburton/Jack Kehler/David Cross/Colombe Jacobsen-Derstine/Peter Spellos/Michael Rivkin/Michael Bailey Smith/Lenny Venito/Howard Spiegel/Alpheus Merchant/Jay Johnston/Joel McKinnon Miller/Derek Cecil/Sean Rouse/Peter Spruyt/Kevin Cotteleer/Marty Belafsky/Rick Baker/Martha Stewart/Michael Jackson/Sid Hillman/Tom Whitenight/Nick Cannon/Andre Blair/Jeremy Howard/Mary Stein/Martin Klebba/John Alexander/Denise Cheshire/Ernie Grunwald/Chloe Sonnenfeld/John Andrew Berton Jr./William E. Jackson/Doug Jones/Biz Markie/Peter Graves/Linda Kim/Paige Brooks/Stephanie Kemp/Barry Sonnenfeld/Victoria Jones/Michael Garvey/Michael Dahlen/Kevin Grevioux/Derek Mears/Sonny Tipton/John Richardson/Philip Goodwin/Tim Blaney/Greg Ballora/Carl J. Johnson/Thom Fountain/Brad Abrell/Richard Pearson/Rick Avery/Michael Beardsley/Michael Buonomo/Kristin Charney/Patrick Coleman Duncan/Darrell Foster/Ned Gorman/Gene LeBell/Pete Macnamara/Drew Massey/Matthew McGrory/Christopher Metas/Bart Mixon/Alexandra O'Hara/David Patykewich/Martin Pfefferkorn/David C. Roehm Sr./Leo Rogstad/Thomas Rosales Jr./Brandee Sanders/Hannah Sim/Peter Siragusa/Daniel Browning Smith/Brian Steele/Mark Steger/Alan Tuskes/Shannon Watson/Bo Welch,"Kay and Jay reunite to provide our best, last and only line of defense against a sinister seductress who levels the toughest challenge yet to the MIB’s untarnished mission statement – protecting Earth from the scum of the universe. It’s been four years since the alien-seeking agents averted an intergalactic disaster of epic proportions. Now it’s a race against the clock as Jay must convince Kay – who not only has absolutely no memory of his time spent with the MIB, but is also the only living person left with the expertise to save the galaxy – to reunite with the MIB before the earth submits to ultimate destruction. ×",88,3.0,5,384789,https://letterboxd.com/film/men-in-black-ii/,https://a.ltrbxd.com/resized/film-poster/5/1/5/1/3/51513-men-in-black-ii-0-230-0-345-crop.jpg?v=e67cb29305,https://a.ltrbxd.com/resized/sm/upload/ff/w5/52/0g/mib2-1200-1200-675-675-crop-000000.jpg?v=0c77e0a9f4,Success
tt5503686,Hustlers,Hustlers/The Hustlers at Scores/Hustlers - Rache ist sexy/Dolandırıcılar/Le Ragazze di Wall Street - Business I$ Business/ハスラーズ：2019/Queens/As Golpistas/Стриптизёрши/Zlatokopky/Да свалиш Уолстрийт/舞孃騙很大/A Wall Street pillangói/허슬러/Επικίνδυνες Κυρίες/Estafadoras de Wall Street/נוכלות בלי חשבון/Преваранткиње са Вол Стрита/舞女大盗/شیادان/Hustlers - Korkojen kera/Arnaque en talons/Le Ragazze di Wall Street - Business Is Business/Ślicznotki/Шахрайки з Волл-Стріт/Ousadas e Golpistas/Aferistės/Prevarantice s Wall Streeta/Hustlers: Striptease pe Wall Street/豔舞大盜/Afēristes/ハスラーズ/ძარცვა ქუსლებზე/Buscavidas/ยั่ว สวย รวย แสบ/Vũ Nữ Thoát Y/Prevarantke na Wall Streetu/DələQızlar,2019,Comedy/Crime/Drama,Lorene Scafaria,Constance Wu/Jennifer Lopez/Julia Stiles/Keke Palmer/Lili Reinhart/Mercedes Ruehl/Cardi B/Lizzo/Mette/Madeline Brewer/Trace Lysette/Wai Ching Ho/Emma Batiz/Vanessa Aspillaga/Jay Oakerson/Marcy Richardson/G-Eazy/Konstantine Drakopoulos/Dov Davidoff/Brandon Keener/Devin Ratray/Usher/Cate Smit/Kristina Asriyan/Alisa Ermolaev/Frank Whaley/Jacqueline Frances/Alex Breaux/Pamela Stewart/Jon Glaser/Grant MacDermott/Rhys Coiro/Mike Keller/Gianmarco Soresi/Zac Jaffee/Ed Herbstman/Ashley Neal/Georgia X. Lifsher/Hannah Weir/Stormi Maya/Scarlett Sher/Randi Kaplan/Kersti Bryan/Steven Boyer/Mario Polit/Paul Nielsen/Peter O'Connor/Agatha Christine Celleri/John Palladino/John Forte/Zachery Byrd/Momo Judy Ave/Tia Barr/Doris McCarthy/Ken Holmes/David Wenzel/Jack O'Connell/Leonys Delossantos/Leonard Zimmerman,A crew of savvy former strip club employees band together to turn the tables on their Wall Street clients.,110,3.3,5,292079,https://letterboxd.com/film/hustlers-2019/,https://a.ltrbxd.com/resized/film-poster/4/6/9/9/7/1/469971-hustlers-0-230-0-345-crop.jpg?v=f758510a90,https://a.ltrbxd.com/resized/sm/upload/29/xg/nc/tk/hustlers-1200-1200-675-675-crop-000000.jpg?v=5377987e60,Success
tt13320622,The Lost City,The Lost City/The Lost City of D/La Cité perdue/Lost Сity of D/Η Χαμένη Πόλη/Zudusī pilsēta/A Cidade Perdida/La ciudad perdida/Cidade Perdida/Изгубеният град/Izgubljeni grad/Ztracené město/Le Secret de la cité perdue/Das Geheimnis der verlorenen Stadt/Az elveszett város/Dingęs miestas/La Ciudad Perdida/Zaginione miasto/Stratené mesto/로스트 시티/Thành Phố Mất Tích/Kayıp Şehir/失驚無神闖謎城/İtmiş Şəhər/Затерянный город/Le secret de la cité perdue/The Lost City - Das Geheimnis der verlorenen Stadt/La cité perdue/Загублене місто/העיר האבודה/ผจญภัยนครสาบสูญ/失落謎城/რომანი დაკარგულ ქალაქში/迷失之城/المدينة المفقودة/Orașul pierdut/Prarastas miestas/Изгубљени град/ザ・ロストシティ/Izgubljeno mesto/شهر گمشده/La ciutat perduda/Изгубениот град/Kadunud linn,2022,Adventure/Action/Comedy,Aaron Nee/Adam Nee,Sandra Bullock/Channing Tatum/Daniel Radcliffe/Da'Vine Joy Randolph/Brad Pitt/Oscar Nuñez/Patti Harrison/Bowen Yang/Stephen Lang/Joan Pringle/Héctor Aníbal/Thomas Forbes-Johnson/Sli Lewis/Olga Buccarelli/Adam Nee/Raymond Lee/Omar Patin/Anthony Alvarez/Ryan Orr/Alex Schoenauer/Edwin Polanco/Marcy Jarreau/Cynthia Guzmán/Carolina Rohana/Jonathan Lev/Katherine Montes/Toussaint Merionne/Luinis Olaverria/Emerson Gonzalez/Wilson Ureña/Roger Wasserman/Ryan Judd/Zachary Steel/Marcos Sánchez,"Reclusive author Loretta Sage writes about exotic places in her popular adventure novels that feature a handsome cover model named Alan. While on tour promoting her new book with Alan, Loretta gets kidnapped by an eccentric billionaire who hopes she can lead him to the ancient city’s lost treasure that featured in her latest story. Alan, determined to prove he can be a hero in real life and not just on the pages of her books, sets off to rescue her.",112,2.7,5,320262,https://letterboxd.com/film/the-lost-city-2022/,https://a.ltrbxd.com/resized/film-poster/6/7/3/4/7/4/673474-the-lost-city-0-230-0-345-crop.jpg?v=adc61a529d,https://a.ltrbxd.com/resized/sm/upload/tz/89/8o/jx/lost%20city-1200-1200-675-675-crop-000000.jpg?v=ac5a590ea6,Success
