imdb_id,original_title,alternative_titles,release_year,genres,directors,actors,summary,length,rating,rating_max,rating_num,detail_url,poster_url,backdrop_url,status
tt3315342,Logan,Logan/Wolverine 3/엑스맨/로건/Logan Noir/Wolverine 3 - Logan/X-Men: Logan/X-Men 10: Logan/Logan: Trận Chiến Cuối Cùng/LOGAN／ローガン：2017/金刚狼3：殊死一战/Logan - The Wolverine/Λόγκαν/לוגאן: וולברין/Логан/Logan – Farkas/Лоґан: Росомаха/Logan: Wolverine/Loganas. Ernis/Логан: Върколакът/羅根/X-Men 9: Logan - Trận Chiến Cuối Cùng/LOGAN／ローガン/लोगान/โลแกน เดอะ วูล์ฟเวอรีน/لوگان/Logans/لوغان/盧根/ლოგანი,2017,Drama/Science Fiction/Action,James Mangold,Hugh Jackman/Dafne Keen/Patrick Stewart/Elizabeth Rodriguez/Boyd Holbrook/Stephen Merchant/Richard E. Grant/Stephen Dunlevy/Eriq La Salle/Elise Neal/Quincy Fouse/Al Coronel/Frank Gallegos/Anthony Escobar/Reynaldo Gallegos/Krzysztof Soszynski/Daniel Bernhardt/Ryan Sturz/Jef Groff/Brandon Melendy/Oren Hawxhurst/Jeremy Fitzgerald/Chris Palermo/Paul O'Connor/Clinton Roberts/Rocky Abou-Sakher/Keith Jardine/Jean Claude Leuyer/Andrew Arrabito/Sebastian James/Aaron Matthews/Garrett Hammond/Matt McClain/Maureen Brennan/Jason Genao/Hannah Westerfield/Bryant Tardy/Ashlyn Casalegno/Alison Fernandez/Parker Lovein/Jimmy Gonzales/Dave Davis/Lennie Loftin/Mark Ashworth/James Handy/Bryce Romero/Phi Vu/Chester Rushing/David Simpson/Lauren Gros/John Raymond/Vanessa Cloke/Doris Morgado/Katie Anne Mitchell/Lara Grice/James Moses Black/Ned Yousef/Michael Lehr/Baxter Humby/Bryan Sloyer/Daniel Hernández/John Bernecker/Evan Dane Taylor/Joe Nin Williams/Toby Holguin/Robert Wu/Anthony N./Victor Winters-Junco/Eyad Elbitar/Craig Henningsen/Han Soto/Rissa Rose Kilar/Salef Celiz/Aidan Kennedy/Nayah Murphy/Chase Cubia/Emma Teo/Vincenzo Lucatorto/Noell Jellison/Haley Glass/Ella Rowbotham/Hudson Wright/Sebeon Jackson/Kelton DuMont/Damon Carney/Cynthia Woods/Mali O'Connor/David Kallaway/Robert Vargas/David Paris/Gonzalo Robles/Tim Connolly/Mary Peyton Stewart/Julia Holt/Paul Adkins/Michael Love Toliver,"In the near future, a weary Logan cares for an ailing Professor X in a hideout on the Mexican border. But Logan’s attempts to hide from the world and his legacy are upended when a young mutant arrives, pursued by dark forces.",137,4.1,5,1271909,https://letterboxd.com/film/logan-2017/,https://a.ltrbxd.com/resized/sm/upload/f3/ub/fq/f5/gGBu0hKw9BGddG8RkRAMX7B6NDB-0-230-0-345-crop.jpg?v=523ca1f161,https://a.ltrbxd.com/resized/sm/upload/3g/vl/z4/dt/logan-2017-1200-1200-675-675-crop-000000.jpg?v=33cba47db1,Success
tt10648342,Thor: Love and Thunder,Thor: Love and Thunder/雷神4：爱与雷霆/Thor 4/Тор 4/থর: প্রেম এবং বজ্রপাত/Marvel Studios' Thor: Love and Thunder/Thor: Love and Thunder de Marvel Studios/Tors: Mīla un Pērkons/Thor : Amour et tonnerre de Marvel Studios/Thor 4: Tình Yêu và Sấm Sét/თორი: სიყვარული და ჭექა-ქუხილი/토르 4/Թոր: Սեր և ամպրոպ/תור: אהבה ורעם/Thor: Cinta dan Guntur/마블 토르: 러브 앤 썬더/토르 러브 앤 썬더/ธอร์: ด้วยรักและอัสนี/Thor 4 - Love and Thunder/Θορ: Έρωτας και Κεραυνός/Thor - Love and Thunder/Thor: Láska jako hrom/Тор: Любовь и гром/Thor IV/باوکی ڕوحی/Thor Miłość i grom/Thor: Sevgi və Göy Gurultusu/Thor 4: Love and Thunder/Thor：Love And Thunder/Thor: Amor e Trovão/토르: 러브 앤 썬더/Тор: Любов і грім/Thor: Szerelem és Mennydörgés/Thor: Aşk ve Gök Gürültüsü/Thor: Amor y Trueno/雷神索爾：愛與雷霆/ثور : الحب والرعد/Thor: Miłość i grom/Thor: Láska a hrom/Thor : Amour et tonnerre/Thor: Tình Yêu và Sấm Sét/雷神奇俠 4：愛與雷霆/თორი: სიყვარული და ქუხილი/ソー：ラブ＆サンダー/Thor: Ljubav i grom/Thor: Iubire şi tunete/തോർ: ലൗ ആൻഡ് തണ്ടർ/Тор: Любов и гръмотевици/Thor: Ljubezen in grom/Toras. Meilė ir griaustinis/ثور: عشق و تندر/Тор: Љубав и гром/Thor 4 - Love And Thunder/थॉर: लव एंड थंडर/Thor: Armastus ja kõu,2022,Action/Fantasy/Comedy,Taika Waititi,Chris Hemsworth/Natalie Portman/Christian Bale/Tessa Thompson/Taika Waititi/Russell Crowe/Jaimie Alexander/Idris Elba/Chris Pratt/Dave Bautista/Karen Gillan/Pom Klementieff/Sean Gunn/Vin Diesel/Bradley Cooper/Carly Rees/Kat Dennings/Brett Goldstein/Stellan Skarsgård/Luke Hemsworth/Matt Damon/Sam Neill/Melissa McCarthy/Ben Falcone/Suren Jayemanne/Natasha Cheng/Stephen Curry/Bobby Holland Hanton/Daley Pearson/Dianne Close/Greg Mitchell/Briegh Winderbaum/Mayzie Winderbaum/Izaac Winderbaum/Alanis Long Borrello/Emmeline Luka Bale/Kieron L. Dyer/India Rose Hemsworth/Simon Russell Beale/Manny Spero/Jonny Brugh/Andrew Crawford/Chanique Greyling/Brooke Satchwell/Elsa Pataky/Zia Kelly/Rosangela Fasano/Cameron Chapek/Tristan Hemsworth/Samson Alston/Alan Spies/Eliza Matengu/Shari Sebbens/Victoria Zerbst/Johnny Nasser/Jenna Owen/Gemma Dart/Victoria Ferrara/Ava Rodrigo-Porter/Elsa Rodrigo-Porter/Kaan Guldur/Indeia Booc/Indiana Ierano/Cayla Sutherland/Tui Vincent/Garth Wood/Yure Covich/Matatia Foa'i/Alan Dukes/Alan Tsibulya/Arka Das/Simona Paparelli/Nico Cortez/Priscilla Doueihy/Nicole Milinkovic/Chayla Korewha/Imaan Hadchiti/Carmen Foon/Clariza Vicente/Kuni Hashimoto/Stephen Hunter/Justin Paul Hitchcock/Nazih Kheir/Tatyana Gillam/Indiana Evans/Samantha Allsop/Olivia Vasquez/Adam Todd/Josh Heuston/David Hambly/Janessa Dufty/Ava Caryofyllis/Chloé Gouneau/Ben Sinclair/Jane Yubin Kim/Dave Cory/Te Kainga O'Te Hinekahu Waititi/Matewa Kiritapu Waititi/Sasha Hemsworth/Aleph Millepied/Amalia Millepied/Rex Bale/Molly Moriarty/Hannah Gray/Luc Barrett/Luca Darda/Bo Chambers/Zali Mae Harrison/Leeton Alan Ingrey/Evan Stanhope/Jessica May Lynne/Jaimee Rose Lynn/Kim Thien Doan/Simone Landers/Sienna Ngeru/Rafael Siemer/Gabriel Siemer/Ronin Fabi/Arias Vang/Corban Ierano/Xander Mouradian/Jacob Yee/Zhang Chongwei,"After his retirement is interrupted by Gorr the God Butcher, a galactic killer who seeks the extinction of the gods, Thor Odinson enlists the help of King Valkyrie, Korg, and ex-girlfriend Jane Foster, who now wields Mjolnir as the Mighty Thor. Together they embark upon a harrowing cosmic adventure to uncover the mystery of the God Butcher’s vengeance and stop him before it’s too late.",119,2.4,5,1332485,https://letterboxd.com/film/thor-love-and-thunder/,https://a.ltrbxd.com/resized/film-poster/5/4/3/0/0/2/543002-thor-love-and-thunder-0-230-0-345-crop.jpg?v=bc6277fe76,https://a.ltrbxd.com/resized/sm/upload/if/fa/6g/az/thor-1200-1200-675-675-crop-000000.jpg?v=7a8bd83a71,Success
tt6334354,The Suicide Squad,The Suicide Squad/Suicide Squad 2/Отрядът самоубийци/L'Escadron Suicide : La Mission/Az Öngyilkos Osztag/ザ・スーサイド・スクワッド/Brigada sinucigașilor: Misiune ucigașă/Отряд самоубийц 2/Escuadrón suicida/Biệt Đội Cảm Tử/فرقة الانتحار/Yekhidat Ha'Mit'abdim/ذا سويسايد سكواد/Одред отписаних: Нова мисија/Загін самогубців/เดอะ ซุยไซด์ สคอวด/O Esquadrão Suicida/수어사이드 스쿼드/自杀小队2：全员集结/Legion samobójców. The Suicide Squad/Отряд Самоубийц: Миссия Навылет/더 수어사이드 스쿼드/יחידת המתאבדים/The Suicide Squad - Missione suicida/جوخه انتحار ۲/The Suicide Squad: Samovražedná misia/Sebevražedný oddíl/自杀小队：全员集结/El Escuadrón Suicida/Загін самогубців: Місія навиліт/El escuadrón suicida/The Suicide Squad: Suicide Mission/The Suicide Squad – Az öngyilkos osztag/L’escadron suicide : la mission/The Suicide Squad: İntihar Timi/Odred otpisanih: Nova misija/Savižudžių būrys. Mobilizacija/自殺突擊隊：集結/فرقة الإنتحار/เดอะ ซุยไซด์ สควอด/Suicide Squad: Điệp Vụ Cảm Tử/自殺特攻/Pašnāvnieku vienība: Jauna misija/Odred odpisanih: Nova misija/ザ・スーサイド・スクワッド “極”悪党、集結/Suitsiidisalk: uus missioon/الفرقة الإنتحارية/द सुसाइड स्क्वॉड/თვითმკვლელთა რაზმი/L’esquadró suïcida/X特遣队：全员集结,2021,Action/Comedy/Adventure,James Gunn,Margot Robbie/Idris Elba/John Cena/Joel Kinnaman/Sylvester Stallone/Viola Davis/David Dastmalchian/Daniela Melchior/Michael Rooker/Jai Courtney/Peter Capaldi/Alice Braga/Pete Davidson/Joaquín Cosío/Juan Diego Botto/Storm Reid/Nathan Fillion/Taika Waititi/Steve Agee/Sean Gunn/John Ostrander/Flula Borg/Mayling Ng/Stephen Blackehart/Tinashe Kajese/Jennifer Holland/Fernando Martinez/Dee Bradley Baker/Natalia Safran/Jared Leland Gore/Rey Hernandez/Ray Benitez/Reinaldo Faberlle/Jonathan Fritschi/Josh Ventura/Gerardo Davila/Mikaela Hoover/Lynne Ashe/Julio Cesar Ruiz/J.R. Adduci/Curtis Lyons Jr./Maya Le Clark/Elideusa Gomes Almeida/Shanna Kernan/Bridget Taylor/Monica Rivera/Andrea Andrade/Giovanni Rodriguez/Giovannie Cruz/Sergio Carlo/Edgar Zanabria/Grecia Balboa/Kenneth Trujillo/Randy Havens/Michelle Civile/Gabrielle Manning/Michael Aaron Milligan/Diany Rodriguez/Teresita Mans/Terence Rosemore/Lloyd Kaufman/Pom Klementieff/Victoria Paige Watkins,"Supervillains Harley Quinn, Bloodsport, Peacemaker and a collection of nutty cons at Belle Reve prison join the super-secret, super-shady Task Force X as they are dropped off at the remote, enemy-infused island of Corto Maltese.",132,3.5,5,1266812,https://letterboxd.com/film/the-suicide-squad/,https://a.ltrbxd.com/resized/film-poster/3/6/9/8/3/5/369835-the-suicide-squad-0-230-0-345-crop.jpg?v=8503fd610a,https://a.ltrbxd.com/resized/sm/upload/cm/l4/c8/re/the-suicide-squad-1200-1200-675-675-crop-000000.jpg?v=4c7c300153,Success
tt0078788,Apocalypse Now,Apocalypse Now/Apocalypse Now Redux/Haminak Akharozzaman/Kiyamet/Apocalypse Now: The Complete Dossier/Apokalypse Nå!/Šių dienų Apokalipsė. Sugrįžimas/Apocalypse Now: Final Cut/Apocalypse Now: The Workprint/Ilmestyskirja. Nyt./地獄の黙示録/地獄の黙示録・特別完全版/地獄の黙示録　ファイナル・カット/Dommedag nu/Апокалипса данас/지옥의 묵시록/Apokalypsa: Final Cut/Czas Apokalipsy/地獄の黙示録 ファイナル・カット：1979/Apokalypsa Redux/Apocalipse/Kıyamet/Апокалипсис сегодня/Apokalipszis most/Apokalypsa/现代启示录/Apocalypse/აპოკალიფსი დღეს/Αποκάλυψη Τώρα/אפוקליפסה עכשיו/Апокалипсис сега/Апокаліпсис наших днів/Ilmestyskirja. Nyt/現代啟示錄/Apocalipsa acum/Apocalipsis Ahora/اینک آخرالزمان/Šių dienų Apokalipsė/C'est l'apocalypse/Lời Sấm Truyền/กองพันอำมหิต/القيامة الآن/Apokalipsa danas/Tänapäeva apokalüpsis/Mūsdienu apokalipse,1979,Drama/War,Francis Ford Coppola,Martin Sheen/Marlon Brando/Frederic Forrest/Albert Hall/Laurence Fishburne/Sam Bottoms/Robert Duvall/G. D. Spradlin/Harrison Ford/Jerry Ziesmer/Scott Glenn/Kerry Rossall/James Keane/Tom Mason/Cynthia Wood/Dennis Hopper/Colleen Camp/Linda Carpenter/Aurore Clément/Jack Thibeau/Glenn Walken/Damien Leake/Marc Coppola/Bill Graham/Herb Rice/Jerry Ross/Charles Robinson/Nick Nicholson/Don Gordon Bell/R. Lee Ermey/Jim Gaines/Vittorio Storaro/Evan A. Lottman/Francis Ford Coppola/Henry Strzalkowski/William Upton/George Cantero/Joe Estevez/Bo Byers/Frank Villard/Christian Marquand/Michel Pitton/David Olivier/Chrystel Le Pelletier/Roman Coppola/Gian-Carlo Coppola/Robert Julian/Yvon LeSeaux/Daniel Kiewit/Hattie James,"At the height of the Vietnam war, Captain Benjamin Willard is sent on a dangerous mission that, officially, “does not exist, nor will it ever exist.” His goal is to locate - and eliminate - a mysterious Green Beret Colonel named Walter Kurtz, who has been leading his personal army on illegal guerrilla missions into enemy territory.",147,4.4,5,813068,https://letterboxd.com/film/apocalypse-now/,https://a.ltrbxd.com/resized/film-poster/2/6/9/0/2690-apocalypse-now-0-230-0-345-crop.jpg?v=d4f99c09a3,https://a.ltrbxd.com/resized/sm/upload/d4/5v/ik/es/apocalypse-now-1200-1200-675-675-crop-000000.jpg?v=374c4b8863,Success
tt2953050,Encanto,Encanto/Nasze magiczne Encanto/เมืองเวทมนตร์ คนมหัศจรรย์/Enkanto/奇幻魔法屋/엔칸토: 마법의 세계/엔칸토 마법의 세계/Енканто/ミラベルと魔法だらけの家/魔法满屋/la fantastique famille Madrigal/Энканто/Енканто: Світ магії/Enkanto: Sihirli Dünya/魔法滿屋/Encanto : la fantastique famille Madrigal/אנקאנטו/Ενκάντο: Ένας Κόσμος Μαγικός/Encanto: Čarovný svet/Encanto: Naš čarobni svijet/Енканто — магични свет/Encanto: Vùng Đất Thần Kỳ/افسون/إنكانتو/ხიბლი,2021,Comedy/Family/Fantasy/Animation,Byron Howard/Jared Bush,Stephanie Beatriz/María Cecilia Botero/John Leguizamo/Diane Guerrero/Jessica Darrow/Carolina Gaitán/Angie Cepeda/Ravi Cabot-Conyers/Mauro Castillo/Rhenzy Feliz/Wilmer Valderrama/Adassa/Maluma/Rose Portillo/Juan Castano/Sarah-Nicole Robles/Hector Elias/Alan Tudyk/Noemi Josefina Flores/Olga Merediz/Jorge E. Ruiz Cano/Alyssa Bella Candiani/Paisley Day Herrera/Brooklyn Skylar Rodriguez/Ezra Rudulph,"The tale of an extraordinary family, the Madrigals, who live hidden in the mountains of Colombia, in a magical house, in a vibrant town, in a wondrous, charmed place called an Encanto. The magic of the Encanto has blessed every child in the family—every child except one, Mirabel. But when she discovers that the magic surrounding the Encanto is in danger, Mirabel decides that she, the only ordinary Madrigal, might just be her exceptional family’s last hope.",102,3.5,5,1301474,https://letterboxd.com/film/encanto/,https://a.ltrbxd.com/resized/film-poster/4/9/6/5/9/2/496592-encanto-0-230-0-345-crop.jpg?v=3fbb07bf26,https://a.ltrbxd.com/resized/sm/upload/ne/vg/qi/0d/encanto-1200-1200-675-675-crop-000000.jpg?v=fa8e1ec02c,Success
tt5580036,"I, Tonya","I, Tonya/我是托尼娅/Yo soy Tonya/冰之骄女/老娘叫谭雅/アイ トーニャ しじょうさいだいのスキャンダル/아이/토냐/アイ/トーニャ 史上最大のスキャンダル：2017/Yo/Tonya/冰之驕女/Ես Տոնյան/Mən/Moi/Аз/Тоня/Ben/Тоня против всех/Я/Já/Εγώ/Η Τόνια/我，花样女王/Én/Jestem najlepsza. Ja/Eu/老娘叫譚雅/אני/טוניה/Ја/Тоња/Ja/トーニャ 史上最大のスキャンダル/Es/Tonija/Aš esu Tonia/ทอนย่า บ้าให้โลกคลั่ง/Jaz/მე/ტონია/Jo/Tôi/Mina",2017,Drama/Comedy,Craig Gillespie,Margot Robbie/Sebastian Stan/Allison Janney/Julianne Nicholson/Paul Walter Hauser/Bobby Cannavale/Bojana Novaković/Caitlin Carver/Maizie Smith/Mckenna Grace/Suehyla El-Attar Young/Jason Davis/Mea Allen/Cory Chapman/Amy Fox/Cara Mantella/Joshua Mikel/Lynne Ashe/Steve Wedan/Brandon O'Dell/Davin Allen Grindstaff/Daniel Thomas May/Anthony Reynolds/Ricky Russert/Al Bianchi/Miles Mussenden/Annie Livingston/Jan Harrelson/Luray Cooper/Dan Triandiflou/Kelly O'Neal/Lisa Kaye Kinsler/Cecil Love/Alphie Hyorth/Sean Goulding/Bobby Browning/Little Man/Heather Jocelyn Blair/Raven Wynn/Evan George Vourazeris/Joe Heath/Tonya Harding,"Competitive ice skater Tonya Harding rises amongst the ranks at the U.S. Figure Skating Championships, but her future in the sport is thrown into doubt when her ex-husband intervenes.",120,3.9,5,1030675,https://letterboxd.com/film/i-tonya/,https://a.ltrbxd.com/resized/sm/upload/hv/nn/05/ss/d20vOJpywFDoz7Dd4ChomGdP0fr-0-230-0-345-crop.jpg?v=836521d1aa,https://a.ltrbxd.com/resized/sm/upload/w1/7j/rv/gr/i-tonya-1200-1200-675-675-crop-000000.jpg?v=4b81340186,Success
tt0113247,La Haine,La Haine/Hate/Hadet/Hatet/Mržnja/Droits du cité/憎しみ/Neapykanta/Sovraštvo/Viha/Hass - La Haine/증오/L’odio/El odio/De Haat/Ատելություն/Hass/Protesto/L'odio/O Ódio/Nenávist/Nienawiść/Medan vi faller/Ненависть/Мржња/怒火青春/A gyűlölet/השנאה/Το Μίσος/Омраза/恨/Hận Thù,1995,Drama,Mathieu Kassovitz,Vincent Cassel/Hubert Koundé/Saïd Taghmaoui/Abdel Ahmed Ghili/Solo/Joseph Momo/Héloïse Rauth/Rywka Wajsbrot/Olga Abrego/Laurent Labasse/Choukri Gabteni/Nabil Ben Mhamed/Benoît Magimel/Médard Niang/Arash Mansour/Abdel-Moulah Boujdouni/Mathilde Vitry/Christian Moro/Édouard Montoute/JiBi/Félicité Wouassi/Fatou Thioune/Thang-Long/Cut Killer/Sabrina Houicha/Sandor Weltmann/François Levantal/Julie Mauduech/Karin Viard/Peter Kassovitz/Christophe Rossignon/Vincent Lindon/Mathieu Kassovitz/Anthony Souter/Florent Lavandeira/Teddy Marques/Samir Khelif/Tadek Lokcinski/Virginie Montel/Andrée Damant/Marcel Marondo/Karim Belkhadra/Marc Duret/Eric Pujol/Philippe Nahon/Sébastien Tavel/François Toumarkine/José Dalmat/Zinedine Soualem/Bernie Bonvoisin/Cyril Ancelin/Patrick Médioni/Tony Sanchez,"After a chaotic night of rioting in a marginal suburb of Paris, three young friends, Vinz, Hubert and Saïd, wander around unoccupied waiting for news about the state of health of a mutual friend who has been seriously injured when confronting the police.",98,4.5,5,792743,https://letterboxd.com/film/la-haine/,https://a.ltrbxd.com/resized/film-poster/5/1/6/8/4/51684-la-haine-0-230-0-345-crop.jpg?v=b6677cc136,https://a.ltrbxd.com/resized/sm/upload/h5/en/ik/n2/la-haine-1200-1200-675-675-crop-000000.jpg?v=b0b3aed69a,Success
tt2562232,Birdman or (The Unexpected Virtue of Ignorance),Birdman or (The Unexpected Virtue of Ignorance)/Birdman/Birdman avagy a mellőzés meglepő ereje/Birdman - The Unexpected Virtue of Ignorance/Birdman ou (A Inesperada Virtude da Ignorância)/Birdman o la inesperada virtud de la ignorancia/버드맨/Birdman o (La inesperada virtud de la ignorancia)/Birdman - o (L'imprevedibile virtù dell'ignoranza)/Birdman czyli nieoczekiwane pożytki z niewiedzy/בירדמן או (היתרון הבלתי צפוי של הבורות)/Birdman o (la inesperada virtud de la ignorancia)/Birdman o (l'imprevedibile virtù dell'ignoranza)/Бёрдмэн/Birdman oder (Die unverhoffte Macht der Ahnungslosigkeit)/בירדמן/Birdman ή Η Απρόσμενη Αρετή της Αφέλειας/Birdman avagy (A mellőzés meglepő ereje)/鸟人/Бърдмен/Бердмен/Omul Pasăre sau Virtutea nesperată a ignoranței/Birdman ali Nepričakovana odlika nevednosti/Birdman veya (Cahilliğin Umulmayan Erdemi)/مرد پرنده ای/バードマン あるいは（無知がもたらす予期せぬ奇跡）/เบิร์ดแมน มายาดาว/鳥人/Birdman ou (les vertus insoupçonnées de l'ignorance)/Birdman o (La Inesperada Virtud de la Ignorancia)/Човек птица/Putncilvēks/Žmogus-paukštis/飛鳥俠/ბერდმენი/الرجل الطائر/Người Chim/Човекот-птица/Lindmees ehk (võhiklikkuse ootamatu voorus),2014,Drama/Comedy,Alejandro González Iñárritu,Michael Keaton/Emma Stone/Zach Galifianakis/Edward Norton/Andrea Riseborough/Naomi Watts/Amy Ryan/Lindsay Duncan/Merritt Wever/Jeremy Shamos/Damian Young/Kenny Chin/Jamahl Garrison-Lowe/Katherine O'Sullivan/Keenan Shimizu/Akira Ito/Natalie Gold/Michael Siberry/Clark Middleton/William Youmans/Paula Pell/David Fierro/Hudson Flynn/Warren Kelley/Joel Marsh Garland/Brent Bateman/Donna Lynne Champlin/Valentino Musumeci/Taylor Schwencke/Craig muMs Grant/Kyle Knauf/Dave Neal/Kelly Southerland/Roberta Colindrez/Catherine Peppers/Frank Ridley/Janis Corsair/Rakesh G. Shah/Bill Camp/Malachi Weir/Jackie Hoffman/Stephen Adly Guirgis/Glenn Wein/Ebrahim Jaffer/Rain Noe/Susan Blackwell/Anna Hardwick/Dusan Dukic/Helena-Alexis Seymour/Ian Finlay/Lynn Marocola/Paugh Shadow/Vanessa Malanga/Chuck McMahon,"A fading actor best known for his portrayal of a popular superhero attempts to mount a comeback by appearing in a Broadway play. As opening night approaches, his attempts to become more altruistic, rebuild his career, and reconnect with friends and family prove more difficult than expected.",120,4.0,5,1041429,https://letterboxd.com/film/birdman-or-the-unexpected-virtue-of-ignorance/,https://a.ltrbxd.com/resized/film-poster/1/3/9/7/9/5/139795-birdman-0-230-0-345-crop.jpg?v=345680513e,https://a.ltrbxd.com/resized/sm/upload/kx/4x/ga/yt/4C0B33C5-A2DE-4EB9-AC59-139B86E16F9D-1200-1200-675-675-crop-000000.jpg?v=7f65301aa9,Success
tt3521164,Moana,Moana/Moana: Un mar de aventuras/魔海奇緣/Vaiana - Das Paradies hat einen Haken/모아나/Vaiana - La Légende du Bout du Monde/Vaiana/Moana - Um Mar de Aventuras/Смелата Ваяна/海洋奇缘/Vaiana: Potraga za mitskim otokom/Odvážná Vaiana: Legenda o konci světa/موانا/Βαϊάνα/Oceania/モアナと伝説の海/Моана/Vajana/Vaiana: Skarb oceanu/Vaiana: Legenda o oceáne/Vaiana: iskanje bajeslovnega otoka/海洋奇緣/Hành Trình Của Moana/موانا مدبلج بالعامية المصريه/موآنا/Vaiana (1)/la légende du bout du monde/Vaiana 1/Ваяна/מואנה/Moana: Um Mar de Aventuras/Вајана/Vaiana: Iskanje bajeslovnega otoka/ผจญภัยตำนานหมู่เกาะทะเลใต้/მოანა/मोआना,2016,Animation/Adventure/Family/Comedy,John Musker/Ron Clements,Auliʻi Cravalho/Dwayne Johnson/Rachel House/Temuera Morrison/Jemaine Clement/Nicole Scherzinger/Alan Tudyk/Louise Bush/Oscar Kightley/Troy Polamalu/Puanani Cravalho/Lin-Manuel Miranda/Christopher Jackson,"In Ancient Polynesia, when a terrible curse incurred by Maui reaches an impetuous Chieftain’s daughter’s island, she answers the Ocean’s call to seek out the demigod to set things right.",107,3.7,5,1390422,https://letterboxd.com/film/moana-2016/,https://a.ltrbxd.com/resized/film-poster/2/0/1/9/0/9/201909-moana-0-230-0-345-crop.jpg?v=cfeffc2eaa,https://a.ltrbxd.com/resized/sm/upload/2a/dc/ev/uk/moana-1200-1200-675-675-crop-000000.jpg?v=505f3aed6d,Success
tt1748122,Moonrise Kingdom,Moonrise Kingdom/Reino do Nascer da Lua/Королівство Сходу Місяця/문라이즈 킹덤/Moonrise Kingdom. Un reino bajo la luna/El reino de la salida de la Luna/Moonrise Kingdom - Una fuga d'amore/月升王国/Королевство полной луны/Holdfény királyság/Kochankowie z księżyca/Až vyjde měsíc/Kraljevstvo izlazećeg Mjeseca/Ο Έρωτας του Φεγγαριού/ムーンライズ・キングダム/ממלכת אור הירח/Королiвство повного мiсяця/Regatul unde răsare Luna/В царството на пълнолунието/Mēness lēkta karaļvalsts/月昇冒險王國/Až vyjde mesiac/小學雞私奔記/Vương Quốc Trăng Lên/คู่กิ๊กซ่าส์ สารพัดแสบ/Месечево краљевство/قلمرو طلوع ماه/Moonrise Kingdom: Amor Infantil/Kuutõusu kuningriik,2012,Romance/Drama/Comedy,Wes Anderson,Jared Gilman/Kara Hayward/Bruce Willis/Edward Norton/Bill Murray/Frances McDormand/Tilda Swinton/Jason Schwartzman/Bob Balaban/Lucas Hedges/Charlie Kilgore/Harvey Keitel/Chandler Frantz/Gabriel Rush/Seamus Davey-Fitzpatrick/Andreas Sheikh/Rob H. Campbell/L.J. Foley/Tommy Nelson/Larry Pine/Marianna Bassham/Neal Huff/Eric Chase Anderson/Jake Ryan/Tanner Flood/Wyatt Ralff/Max Derderian/Hugo DeAscentis/Liz Callahan/James Demler/Christine Noel/Jean-Michael Pion/John Peet/Carolyn Pickman/Ada-Nicole Sanger/Isabella Guinness/Violet Guinness/Caris Yeoman/Lily Tiger McEnerney/Kevin DeCoste/Tyler Metivier/Cooper Murray/Coledyn Garrow/Ben Haffner/Michael Malvesti/Richie Conant/Johnathon Deneault/Jack Lescoulie/Preston Hatch/Alex Milne/Jordan Puzzo/Steve Smith/Dakota Pimentel/Roman Keitel/Derek Sardella/John Franchi/Al Conti,"Set on an island off the coast of New England in the summer of 1965, Moonrise Kingdom tells the story of two twelve-year-olds who fall in love, make a secret pact, and run away together into the wilderness. As various authorities try to hunt them down, a violent storm is brewing off-shore – and the peaceful island community is turned upside down in more ways than anyone can handle.",94,4.0,5,943015,https://letterboxd.com/film/moonrise-kingdom/,https://a.ltrbxd.com/resized/sm/upload/v5/7f/mn/y8/ysTohGF7NY9Z6MYz9vLNYiyzh0r-0-230-0-345-crop.jpg?v=689b2b9ee8,https://a.ltrbxd.com/resized/sm/upload/4k/oa/11/ey/D58EA72B-4E54-4EC1-B24C-89E76F6FF7D4-1200-1200-675-675-crop-000000.jpg?v=ce2a7359ec,Success
