imdb_id,original_title,alternative_titles,release_year,genres,directors,actors,summary,length,rating,rating_max,rating_num,detail_url,poster_url,backdrop_url,status
tt7653254,Marriage Story,Marriage Story/Récit d'un Mariage/결혼 이야기/Historia de un matrimonio/Evlilik Hekayəsi/Ιστορία Γάμου/Брачна история/História de um Casamento/История о супружестве/Storia di un matrimonio/סיפור נישואים/婚姻故事/Historia małżeńska/Házassági történet/Шлюбна історія/Прича о браку/Manželská historie/マリッジ・ストーリー/Une histoire de mariage/ქორწინების ისტორია/Câu chuyện hôn nhân/Poveste despre căsnicie/แมริเอจ สตอรี่/Santuokos istorija/داستان ازدواج/Història d’un matrimoni/Abielu lugu,2019,Drama,Noah Baumbach,Adam Driver/Scarlett Johansson/Laura Dern/Alan Alda/Ray Liotta/Julie Hagerty/Merritt Wever/Azhy Robertson/Wallace Shawn/Martha Kelly/Mark O'Brien/Julia Greer/Matthew Maher/Eric Berryman/Mickey Sumner/Jasmine Cephas Jones/Gideon Glick/Motell Gyn Foster/David Turner/Raymond J. Lee/Mary Wiseman/Pete Simpson/Irene Choi/Matthew Shear/Becca Blackwell/Brooke Bloom/Hannah Dunne/McKinley Belcher III/Roslyn Ruff/Santiago Mallan/Robert Smigel/Amanda Rovner/Carlos Jacott/Sarah Jones/Dean Wareham/Bashir Salahuddin/Vinny Chhibber/Ayden Mayeri/Erin Evans/Lucas Neff/Annie Hamilton/Tunde Adebimpe/Jordyn Curet/Justin Claiborne/Kyle Bornheimer/Pilar Holland/Emily Cass McDonnell/Andrew Steven Hernandez/Amir Talai/Juan Alfonso/Connie Marie Flores/Jeremy Barber/Rich Fulcher/Mary Hollis Inboden/Peter Oliver/Bill Blair,"A stage director and an actress struggle through a grueling, coast-to-coast divorce that pushes them to their personal extremes.",137,4.0,5,1244976,https://letterboxd.com/film/marriage-story-2019/,https://a.ltrbxd.com/resized/film-poster/4/2/2/6/8/2/422682-marriage-story-0-230-0-345-crop.jpg?v=a312d638d9,https://a.ltrbxd.com/resized/sm/upload/q9/0n/be/sq/marriage-story-1200-1200-675-675-crop-000000.jpg?v=150e60d1ae,Success
tt2395427,Avengers: Age of Ultron,Avengers: Age of Ultron/Marvel Avengers: Age of Ultron/The Avengers 2/Os Vingadores 2 - Era de Ultron/Marvel's Avengers: Age of Ultron/Os Vingadores: A Era de Ultron/Vingadores 2/The Avengers Age of Ultron/复仇者联盟2：奥创纪元/Marvel's The Avengers 2: Age of Ultron/마블 어벤져스: 에이지 오브 울트론/어벤져스 2/Avengers 2: Vek Ultrona/어벤져스 에이지 오브 울트론/Avengers - L'Ère d'Ultron/Avengers - Age of Ultron/Marvel Studios' Avengers: Age of Ultron/Avengers 2 - Age of Ultron/Os Vingadores - A Era de Ultron/Bosszúállók: Ultron kora/Avengers/L'ère d'Ultron/Vengadores 2 La era de Ultron/Avengers 2: Đế Chế Ultron/შურისმაძიებლები: ალტრონის ხანა/Avengers 2 - L'Ère d'Ultron/Avengers: Czas Ultrona/Avengers II: Age of Ultron/アベンジャーズ／エイジ・オブ・ウルトロン：2015/Кек алушылар: Альтрон дәуірі/Avengers：Age Of Ultron/Avengers : L'Ère d'Ultron/Мстители: Эра Альтрона/Vengadores: La Era de Ultrón/Vingadores: A Era de Ultron/הנוקמים: עידן אולטרון/المنتقمون عهد الترون/Отмъстителите: Ерата на Ултрон/Εκδικητές: Η Εποχή του Ultron/Месники: Ера Альтрона/Răzbunătorii: Sub semnul lui Ultron/어벤져스: 에이지 오브 울트론/อเวนเจอร์ส: มหาศึกอัลตรอนถล่มโลก/Yenilmezler: Ultron Çağı/アベンジャーズ／エイジ・オブ・ウルトロン/Avengers: Vek Ultrona/Osvetnici 2: Vladavina Ultrona/انتقام جویان: عصر آلترون/Vingadores: Era de Ultron/復仇者聯盟2：奧創紀元/Avengers 2: Era de Ultrón/Avengers : L'ère d'Ultron/შურისმაძიებლები: ალტრონის ერა/Осветници: Ера Алтрона/Atriebēji: Ultrona laikmets/Keršytojai. Altrono amžius/復仇者聯盟 2：奧創紀元/Qasoskorlar: Altron Davri/Maščevalci: Ultronova doba/Venjadors: L’era d’Ultron/अवेंजर्स 2: कलयुग का महायुद्ध/Tasujad: Ultroni ajastu,2015,Science Fiction/Action/Adventure,Joss Whedon,Robert Downey Jr./Chris Hemsworth/Mark Ruffalo/Chris Evans/Scarlett Johansson/Jeremy Renner/James Spader/Samuel L. Jackson/Don Cheadle/Aaron Taylor-Johnson/Elizabeth Olsen/Paul Bettany/Cobie Smulders/Anthony Mackie/Hayley Atwell/Idris Elba/Linda Cardellini/Stellan Skarsgård/Claudia Kim/Thomas Kretschmann/Andy Serkis/Julie Delpy/Stan Lee/Henry Goodman/Chris Luca/Brian Schaeffer/Dominique Provost-Chalkley/Isaac Andrews/Gareth Kieran Jones/Chan Woo Lim/Minhee Yeo/Bentley Kalu/Julian Bleach/Christopher Beasley/Vuyo Dabula/Nondumiso Tembe/Kabelo Thai/Lele Ledwaba/Mandla Gaduka/Harriet Lenabe/Beulah Hashe/Musca Kumalo/Mathapelo September/Antony Acheampong/Chioma Anyanwu/Ben Sakamoto/Imogen Poynton/Isabella Poynton/Ingvild Deila/Sunny Yeo/Namju Go/Mina Kweon/Earl T. Kim/Arthur Lee/Verity Hewlett/Michael Matovski/Alma Noce/Riccardo Richetta/Constanza Ruff/Monty Mclaren-Clark/Julia Krynke/Tony Christian/Ian Kay/Barry Aird/Aaron Himelstein/Kerry Condon/Jaiden Stafford/Josh Brolin/Robert J. Fraser/Lou Ferrigno/Zakk Pierce,"When Tony Stark tries to jumpstart a dormant peacekeeping program, things go awry and Earth’s Mightiest Heroes are put to the ultimate test as the fate of the planet hangs in the balance. As the villainous Ultron emerges, it is up to The Avengers to stop him from enacting his terrible plans, and soon uneasy alliances and unexpected action pave the way for an epic and unique global adventure.",141,3.2,5,1609456,https://letterboxd.com/film/avengers-age-of-ultron/,https://a.ltrbxd.com/resized/film-poster/8/1/6/0/5/81605-avengers-age-of-ultron-0-230-0-345-crop.jpg?v=d315efaff1,https://a.ltrbxd.com/resized/sm/upload/gz/xu/8d/m4/avengers-age-of-ultron-1200-1200-675-675-crop-000000.jpg?v=489fa4b87c,Success
tt1727824,Bohemian Rhapsody,Bohemian Rhapsody/波希米亞狂想曲/Bogema rapsodiyasi/Bogemcha rapsodiya/Bohém rapszódia/Богемская рапсодия/โบฮีเมียน แรปโซดี/ボヘミアン・ラプソディ/Бохемска рапсодия/Богемна рапсодія/רפסודיה בוהמית/보헤미안 랩소디/波希米亞狂想曲：搖滾傳說/波西米亚狂想曲/Боемска Рапсодија/Bohēmista rapsodija/الملحمة البوهيمية/Bohemijos rapsodija/Bohemian Rhapsody: Huyền Thoại Ngôi Sao Nhạc Rock/Bogemli rapsodiya/ბოჰემური რაფსოდია/Boemska rapsodija/बोहीमियन रैप्सडी,2018,Music/Drama,Bryan Singer,Rami Malek/Gwilym Lee/Ben Hardy/Joseph Mazzello/Lucy Boynton/Aidan Gillen/Allen Leech/Tom Hollander/Mike Myers/Aaron McCusker/Meneka Das/Ace Bhatti/Priya Blackburn/Max Bennett/Dermot Murphy/Dickie Beau/Jack Roth/Neil Fox-Roberts/Jess Radomska/Michelle Duncan/Ross Green/Bruce Mackinnon/Joshua Higgott/Pat Lally/William Owen/Philip Andrew Truempi/Tim Plester/Felipe Bejarano/Kieran Hardcastle/Martin Oelbermann/Ian Gabriel Dumdum/Matt Greenwood/Royce Cronin/James MacLaren/Andrew Bowerman/Drew P./Seren Gibson/Honor Hellon/Rosy Benjamin/Leila Crerar/Katherine Newman/Adam Rauf/Peter Howe/John Ottman/James Wallace/Matthew Houston/Scott Morrison Watson/Devlin Lloyd/Stefan Kopiecki/Garry Summers/Matthew Fredricks/Ian Jareth Williamson/Adam Lazarus/Johanna Thea/Adam Lambert/Andreea Helen David/Adam James Johnston/Freddie Mercury/Charlotte Sharland/Ray Andrew/Vincent Andriano/Lasco Atkins/Michael Ballard/Fiona Burt/Kiana Chang Sigel/Milo Chang Sigel/Jonathan Cheetham/Michael Cobb/Peter Coe/Ellis Crewe-Candy/Adrian Danila/Rochelle De-Terville/Steffan Donnelly/Chris Ecob/Amor Evans/Jesús Gallo/Carla Garratt/Flora Grant/Shane Griffin/Rishi Gupta/James Hare/Ian Harrod/Leo Hunter/Timothy Christian Jansen/Sammy Johnston/Mark Kempson/Doug Kirby/Lex Lamprey/Jorge Leon/Ian Mansfield/Kas Meghani/Alicia Mencía Castaño/Philips Nortey/Jose Palma/Richard Price/Jason Redshaw/Graham J. Reeves/Jonathan Rushby-Taylor/Freddie Ryde/Linus Scheithauer/Bobby Shue/Lee Simmons/Dave Simon/Amanda Smith/Winson Ting/Stuart Whelan/Aidan White/Sarah Woodruff/Miroslav Zaruba/Joanna Zwierzynska/Karl Farrer,"Singer Freddie Mercury, guitarist Brian May, drummer Roger Taylor and bass guitarist John Deacon take the music world by storm when they form the rock ’n’ roll band Queen in 1970. Hit songs become instant classics. When Mercury’s increasingly wild lifestyle starts to spiral out of control, Queen soon faces its greatest challenge yet – finding a way to keep the band together amid the success and excess.",135,3.5,5,1542442,https://letterboxd.com/film/bohemian-rhapsody/,https://a.ltrbxd.com/resized/film-poster/3/5/8/2/2/2/358222-bohemian-rhapsody-0-230-0-345-crop.jpg?v=e24822a0b4,https://a.ltrbxd.com/resized/sm/upload/k9/3d/fk/mh/bohemian-rhapsody-1200-1200-675-675-crop-000000.jpg?v=df22ddf0f7,Success
tt2488496,Star Wars: The Force Awakens,Star Wars: The Force Awakens/Star Wars: Episodio VII - El Despertar de la Fuerza/Star Wars: Episodio VII - Il risveglio della Forza/Star Wars: Episódio VII - O Despertar da Força/スター・ウォーズ／フォースの覚醒/جنگ ستارگان: نیرو بر می خیزد/Зоряні війни: Пробудження сили/Star Wars: Episodi VII - Voima herää/Star Wars: Episode VII - Das Erwachen der Macht/Star Wars: Güç Uyanıyor/Звёздные войны: Пробуждение силы/Žvaigždžių karai: Epizodas VII – galia nubunda/Star Wars - Episode VII - The Force Awakens/Star Wars - Episode VII - Le Réveil de la Force/Star Wars: Epizoda VII – Síla se probouzí/스타워즈-깨어난 포스/Star Wars Episode VII Das Erwachen der Macht/Star Wars: Episode VII - The Force Awakens/La guerra de las galaxias. Episodio VII. El despertar de la fuerza/Star Wars: The Force Awakens (Episode VII)/Star Wars: Espisodio VII: El despertar de la fuerza./Gwiezdne Wojny VII - Przebudzenie Mocy/星球大战7：原力觉醒/Csillagok Háborúja VII. - Az Ébredő Erő/ვარსკვლავური ომები: ძალის გამოღვიძება (ეპიზოდი VII)/ვარსკვლავური ომები: ეპიზოდი VII – ძალის გამოღვიძება/ვარსკვლავური ომები: ეპიზოდი 7/ვარსკვლავური ომები 7/ვარსკვლავური ომები: ეპიზოდი IX/ვარსკვლავური ომები VII/Star Wars: Episode 7 - Das Erwachen der Macht/Star Wars: Episode VII/סטאר וורס פרק VII: הכח מתעורר/Star Wars/épisode VII - Le Réveil de la Force/Աստղային պատերազմներ. ուժի զարթոնքը/Chiến Tranh Giữa Các Vì Sao 7: Thần Lực Thức Tỉnh/Жұлдызды соғыстар: Күштің оянуы/The Force Awakens/Star Wars: Episode 7 - The Force Awakens/La guerre des étoiles VII - Le réveil de la force/Star Wars : Le réveil de la force/La guerra de las galaxias. Episodio 7/El despertar de la fuerza/Star Wars - Episodio VII - Il risveglio della Forza/星球大戰：原力覺醒/Star Wars Episode VII - The Force Awakens/Star Wars - Episode 7 - Das Erwachen der Macht/Star Wars: 原力覺醒/Star Wars Episode VII：The Force Awakens/Star Wars: Das Erwachen der Macht/Star Wars: Il risveglio della Forza/Star Wars: Az ébredő Erő/Star Wars: El despertar de la fuerza/Звёздные войны: Эпизод 7 - Пробуждение силы/Star Wars: Sila sa prebúdza/Star Wars : Le Réveil de la Force/스타워즈 에피소드 7: 깨어난 포스/Star Wars: Síla se probouzí/Războiul stelelor - Episodul VII: Trezirea Forței/מלחמת הכוכבים 7: הכוח מתעורר/Gwiezdne wojny: Przebudzenie Mocy/Star Wars: Επεισόδιο VII - Η Δύναμη Ξυπνάει/Междузвездни войни: Силата се пробужда/สตาร์ วอร์ส เอพพิโซด 7: อุบัติการณ์แห่งพลัง/Ratovi zvijezda: Epizoda VII - Sila se budi/Stjörnu Stríð: Mátturinn leysist úr læðingi/Зоряні війни: Епізод 7 — Пробудження сили/Star Wars: O Despertar da Força/épisode VII : Le réveil de la force/Star Wars: El despertar de la força/星際大戰七部曲：原力覺醒/Star Wars 7: Thần Lực Thức Tỉnh/Vojna zvezd: Sila se prebuja/Ратови звезда: Eпизода VII - Буђење силе/Žvaigždžių karai: Galia nubunda/Zvaigžņu kari: Spēks mostas/ვარსკვლავური ომები: ძალის გამოღვიძება/Tähtede sõda: Jõud tärkab/Star Wars: दिव्यशक्ति की ललकार,2015,Action/Adventure/Science Fiction,J.J. Abrams,Harrison Ford/Mark Hamill/Carrie Fisher/Adam Driver/Daisy Ridley/John Boyega/Oscar Isaac/Lupita Nyong'o/Andy Serkis/Domhnall Gleeson/Anthony Daniels/Max von Sydow/Peter Mayhew/Gwendoline Christie/Joonas Suotamo/Pip Andersen/Simon Pegg/Kiran Shah/Sasha Frost/Pip Torrens/Andrew Jack/Rocky Marshall/Greg Grunberg/Emun Elliott/Brian Vernel/Yayan Ruhian/Sebastian Armesto/Maisie Richardson-Sellers/Warwick Davis/Cailey Fleming/Mark Stanley/Ken Leung/Iko Uwais/Anna Brewster/Harriet Walter/Tim Rose/Erik Bauersfeld/Mike Quinn/Bill Kipsang Rotich/Michael Giacchino/Nigel Godrich/Judah Friedlander/Victor McGuire/Miltos Yerolemou/Francesca Longrigg/D.C. Barns/Billie Lourd/Leanne Best/Crystal Clarke/Jeffery Kissoon/Claudia Sermbezis/Gerald W. Abrams/Jim McGrath/Philicia Saunders/Morgan Dameron/Jessica Henwick/Tosin Cole/James McArdle/Stefan Grube/Dixie Arnold/Hannah John-Kamen/Kate Fleetwood/Thomas Brodie-Sangster/Tom Edden/Brian Herring/Dave Chapman/Jimmy Vee/Cecep Arif Rahman/Ian Whyte/Daniel Craig/Ewan McGregor/Frank Oz/Alec Guinness/Tom Kane/Catherine Taber/Matthew Wood/Sam Witwer/Meredith Salenger/James Arnold Taylor/Michael Donovan/Devon Libran/Robert Stambler/Verona Blue/Fred Tatasciore/Patrick Correll/Karen Huie/Orly Schuchmacher/Ben Schwartz/Mark Dodson/Liang Yang/David Acord/Jamie B. Chambers/David M. Santana/Richard Riddell/Jefferson Hall/Jack Laskey/Daniel Adjei/Charlie Akin/Adrian Allan/Samantha Alleyne/Paul Biddiss/Hannah Blamires/Rony Bridges/Stuart Budd/Calvin Chen/Alan Chimes/Jamie Clay/David W. Collins/Cavin Cornwall/Rowan Cox/Nathalie Cuzner/Rimmel Daniel/Keith De'Winter/Adrian Derrick-Palmer/Cameron Edwards/Jesse Michael Fullington/Gloria Garcia/Salo Gardner/Caroline Garnell/Chris Geden/Versha Grant/Steven James Griffiths/Gary Hailes/Tim Hammersley/Chris Hastings/Marina Hayter/Kelvin Hewlett/Matthew Hobbs/Phil Hodges/Leigh Holland/Kevin Hudson/Phoenix James/Zander James/Tobias James-Samuels/Paul Kasey/Aaron Kennedy/Aidan Knight/Sanj Krishnan/Lukas Landau/Andrei Lenart/Jorge Leon/Julia Leyland/Billy James Machin/Raymond Mamrak/Kelsey Edwards/Kenny-Lee Mbanefo/David McCarrison/Sandeep Mohan/Benjayx Murphy/Robert Strange/Charlie Nevett/Jason Nicholls/Terry Noble/David Norfolk/Tatsujiro Oto/Gillian Pittaway/Nathan Plant/Elroy Powell/Jay Rincon/Marc Rolfe/Julio Romeo/Arti Shah/Kat Sheridan/Stephanie Silva/Jasper Skinner/Sandy Kate Slade/Clem So/Benito Sovrano/Karol Steele/François Sternkiker/Frank Stone/Andy Sweet/Peter Theobalds/Pablo Verdejo/Ashley Ward/Paul Warren/Topo Wresniwiro/Joshua Ásberg/Joe Cash/Clare Glass/Kevin Smith/Daran Holliman/Bill Hader,"Thirty years after defeating the Galactic Empire, Han Solo and his allies face a new threat from the evil Kylo Ren and his army of Stormtroopers.",136,3.3,5,1584517,https://letterboxd.com/film/star-wars-the-force-awakens/,https://a.ltrbxd.com/resized/sm/upload/t1/n6/d1/k6/g2mqdMU3jaz6uEosF5aqJgbw7e9-0-230-0-345-crop.jpg?v=f105fa4be0,https://a.ltrbxd.com/resized/sm/upload/w7/zg/ko/rl/star-wars-force-awakens-1200-1200-675-675-crop-000000.jpg?v=e253ef9dc0,Success
tt0084787,The Thing,"The Thing/A valami/John Carpenter's The Thing/La chose/Tvor/Object from Planet X/El enigma de otro mundo/A Coisa/더 씽/Creatura/The Thing – ""se"" jostakin/L'effroyable Chose/괴물/Coś/چیز/La cosa (El enigma de otro mundo)/La cosa/怪形/Das Ding aus einer anderen Welt/Veio do Outro Mundo/Věc/Нечто/A Dolog/Vec/Şey/Det grusomme udefra/Η Απειλή/היצור/遊星からの物体X/O Enigma de Outro Mundo/突變第三型/Щось/Нещото/The Thing - ""se"" jostakin/Padaras/La cosa del otro mundo/Stvor/Створ/Tingen fra en annen verden/ไอ้ตัวเขมือบโลก/Quái Vật Biến Hình/Võõrkeha/موجود/الشيء",1982,Mystery/Science Fiction/Horror,John Carpenter,Kurt Russell/Keith David/Wilford Brimley/T.K. Carter/David Clennon/Richard Dysart/Charles Hallahan/Peter Maloney/Richard Masur/Donald Moffat/Joel Polis/Thomas G. Waites/Norbert Weisser/Larry Franco/Nate Irwin/William Zeman/Jed/John Carpenter/Adrienne Barbeau,"A twelve-man team at a remote Antarctic research station discovers an alien buried in the snow for over 100,000 years. Soon unfrozen, the form-changing creature wreaks havoc, creates terror…And becomes one of them.",109,4.4,5,1017439,https://letterboxd.com/film/the-thing/,https://a.ltrbxd.com/resized/sm/upload/t3/qn/vs/p5/s5fH3GqFcHbi2F0NSBSh4KRNTc0-0-230-0-345-crop.jpg?v=01880125bb,https://a.ltrbxd.com/resized/sm/upload/5o/hu/mf/ae/thing-1200-1200-675-675-crop-000000.jpg?v=1c6f57f7a4,Success
tt1131734,Jennifer’s Body,Jennifer’s Body/El cuerpo de Jennifer/辣得要命/Tijelo lijepe Jennifer/Dzeniferes kunas/Zabójcze cialo/죽여줘 제니퍼/Le corps de Jennifer/ジェニファーズ・ボディ/Jennifer'ın Bədəni/陰點鬼情人/辣的要命/Jennifer's Body - Jungs nach ihrem Geschmack/Kana Susadım/Тело Дженнифер/O Corpo de Jennifer/Ördög bújt beléd/Zabójcze ciało/詹妮弗的肉体/Jennifer's Body - Bacha/kouše!/הגוף של ג'ניפר/Το Σώμα που Σκοτώνει/Corpul lui Jennifer/Garota Infernal/Telo lepe Jennifer/죽여줘! 제니퍼/Страстите на Дженифър/Diabólica tentación/Jenniferning tanasi/Dženiferės kūnas/Тіло Дженніфер/Pozor hryzie!/Thân Xác Ác Quỷ/Опасна Џенифер/เจนนิเฟอร์'ส บอดี้ สวย ร้อน กัด สยอง/ჯენიფერის სხეული,2009,Horror/Comedy,Karyn Kusama,Megan Fox/Amanda Seyfried/Johnny Simmons/Adam Brody/Sal Cortez/Ryan Levine/Juan Riedinger/Colin Askey/Chris Pratt/Juno Rinaldi/Kyle Gallner/Josh Emerson/J.K. Simmons/Amy Sedaris/Cynthia Stevenson/Nicole Leduc/Aman Johal/Dan Joffre/Candus Churchill/Carrie Genzel/Emma Gallello/Megan Charpentier/Jeremy Schuetze/Valerie Tian/Emily Tennant/Karissa Tynes/Eve Harlow/Michael Brock/Genevieve Buechner/Adrian Hough/Gabrielle Rose/Michael Bean/Bill Fagerbakke/Marilyn Norry/Cut Chemist/Zoe LaLiberté/Chelsey Smith/Whitney Chow/Michael Orstad/Ronnie Robinson/Ed Anders/Roxanne Wong/Diane Dutra/Maya Toews/Diablo Cody/Lance Henriksen,"Jennifer, a gorgeous, seductive cheerleader takes evil to a whole new level after she’s possessed by a sinister demon. Now it’s up to her best friend to stop Jennifer’s reign of terror before it’s too late.",107,3.4,5,1119585,https://letterboxd.com/film/jennifers-body/,https://a.ltrbxd.com/resized/film-poster/3/9/3/0/5/39305-jennifer-s-body-0-230-0-345-crop.jpg?v=af7fb6bd86,https://a.ltrbxd.com/resized/sm/upload/o6/5q/es/8z/jennifers-body-1200-1200-675-675-crop-000000.jpg?v=c2a320ab47,Success
tt0071562,The Godfather Part II,The Godfather Part II/The Godfather Part 2/El Padrino II/Mario Puzo's The Godfather: Part II/Kummisetä/osa II/Le Parrain 2/The Godfather 2/教父续集/教父 II/Крёстный отец 2/教父 2/El Padrino. Parte 2/O Poderoso Chefão 2/El Padrino/Parte 2/De Peetvader Deel II/Gudfadern del II/The Godfather - Part II/Крестный отец 2/Baba 2/Le Parrain - 2ème partie/El padrí: 2a part/教父Ⅱ/Ojciec chrzestny/część II/Der Pate 2/ゴッドファーザーPART2/Der Pate II/ゴッドファーザー PART II：1974/The Godfather: Part II/Ο Νονός - Μέρος 2ο/Xaç Atası 2/Kmotr 2/O Padrinho - Parte II/Կնքահայրը 2/Kumbari: Pjesa II/Baba Bölüm 2/Ojciec chrzestny 2/Der Pate - Teil II/Kummisetä II/Le Parrain/2e partie/Il padrino - Parte II/A keresztapa 2./教父2/Baba II/O Padrinho: Parte II/El Padrino Parte II/پدرخوانده: بخش ۲/Ojciec chrzestny II/The Godfather 2. del/Kmotr II/Кум 2/Ο Νονός 2/Кръстникът II/대부 2/הסנדק: חלק שני/ゴッドファーザー PART II/Хрещений батько 2/Nașul II/Krstný otec II/O Poderoso Chefão: Parte II/Gudfaren 2/教父II/Le parrain II/Krusttēvs 2/Kum 2/Krikštatėvis II/Cho‘qintirgan ota 2/Guðfaðirinn: Hluti 2/教父續集/Bố Già 2/العراب: الجزء الثاني/เดอะ ก็อดฟาเธอร์ ภาค 2/द गॉडफ़ादर: पार्ट 2/El padrí 2/ნათლია: ნაწილი მეორე/Ristiisa 2/Boter 2,1974,Drama/Crime,Francis Ford Coppola,Al Pacino/Robert Duvall/Diane Keaton/Robert De Niro/John Cazale/Talia Shire/Lee Strasberg/Michael V. Gazzo/G. D. Spradlin/Richard Bright/Gastone Moschin/Tom Rosqui/Bruno Kirby/Frank Sivero/Francesca De Sapio/Morgana King/Marianna Hill/Leopoldo Trieste/Dominic Chianese/Amerigo Tot/Troy Donahue/John Aprea/Joe Spinell/Abe Vigoda/Tere Livrano/Gianni Russo/Maria Carta/Oreste Baldini/Giuseppe Sillato/Mario Cotone/James Gounaris/Fay Spain/Harry Dean Stanton/David Baker/Carmine Caridi/Danny Aiello/Carmine Foresta/Nick Discenza/Joseph Medaglia/William Bowers/Joseph Della Sorte/Carmen Argenziano/Joe Lo Grippo/Ezio Flagello/Livio Giorgi/Kathleen Beller/Saveria Mazzola/Tito Alba/Johnny Naranjo/Elda Maida/Salvatore Po/Ignazio Pappalardo/Andrea Maugeri/Peter LaCorte/Vincent Coppola/Peter Donat/Tom Dahlgren/Paul B. Brown/Phil Feldman/Roger Corman/Ivonne Coll/Joe De Nicola/Edward Van Sickle/Gabriella Belloni/Richard Watson/Venancia Grangerard/Erica Yohn/Teresa Tirelli/James Caan/Italia Coppola/Roman Coppola/Sofia Coppola/Victor Pujols Faneyte/Julie Gregg/Larry Guardino/Buck Houghton/Sho Kosugi/Gary Kurtz/Richard Matheson/John Megna/Jay Rasumny/Filomena Spagnuolo/Julian Voloshin/Laura Lyons/Harrison Ressler,"In the continuing saga of the Corleone crime family, a young Vito Corleone grows up in Sicily and in 1910s New York. In the 1950s, Michael Corleone attempts to expand the family business into Las Vegas, Hollywood and Cuba.",202,4.6,5,1086522,https://letterboxd.com/film/the-godfather-part-ii/,https://a.ltrbxd.com/resized/film-poster/5/1/8/1/6/51816-the-godfather-part-ii-0-230-0-345-crop.jpg?v=6a49853f25,https://a.ltrbxd.com/resized/sm/upload/rw/q1/s4/xy/the-godfather-part-ii-1200-1200-675-675-crop-000000.jpg?v=e76eb25900,Success
tt0892769,How to Train Your Dragon,How to Train Your Dragon/驯龙高手/Így neveld a sárkányodat 3D/드래곤 길들이기 1/Draktränaren 1/Ako vycvičiť draka/Ako vycvičiť draka 1/Dragons/Hoe tem je een draak/Ejderhanı Nasıl Eğitirsin/Bí Kíp Luyện Rồng/Drachenzaehmen leicht gemacht/Cómo entrenar a tu dragón/Näin koulutat lohikäärmeesi/Kako izdresirati zmaja/Drachenzähmen leicht gemacht/Как приручить дракона/Jak vycvičit draka/Como Treinares o Teu Dragão/Sådan træner du din drage/Dragon Trainer/Így neveld a sárkányodat/Draktränaren/Dragetreneren/Ako si vycvičiť draka/Hoe Tem Je Een Draak/Jak wytresować smoka/הדרקון הראשון שלי/Како да дресирате свог змаја/อภินิหารไวกิ้งพิชิตมังกร/Πώς να Εκπαιδεύσετε το Δράκο σας/Að temja drekann sinn/드래곤 길들이기/Как да си дресираш дракон/ヒックとドラゴン/Як приборкати дракона/Cum să îți dresezi dragonul/Com ensinistrar un drac/Kuidas taltsutada lohet/Como Treinar o Seu Dragão/馴龍高手/Cómo Entrenar A Tu Dragón/چگونه اژدهای خود را تربیت کنیم/Kā pieradināt pūķi/Kaip prisijaukinti slibiną/როგორ მოვარჯულოთ დრაკონი/Kako izuriti svojega zmaja/كيف تروض تنينك/馴龍記,2010,Fantasy/Family/Adventure/Animation,Dean DeBlois/Chris Sanders,Jay Baruchel/Gerard Butler/Craig Ferguson/America Ferrera/Jonah Hill/Christopher Mintz-Plasse/T.J. Miller/Kristen Wiig/Robin Atkin Downes/Philip McGrade/Kieron Elliott/Ashley Jensen/David Tennant,"As the son of a Viking leader on the cusp of manhood, shy Hiccup Horrendous Haddock III faces a rite of passage: he must kill a dragon to prove his warrior mettle. But after downing a feared dragon, he realizes that he no longer wants to destroy it, and instead befriends the beast – which he names Toothless – much to the chagrin of his warrior father.",98,4.1,5,1434356,https://letterboxd.com/film/how-to-train-your-dragon/,https://a.ltrbxd.com/resized/sm/upload/0r/r7/c6/7e/hIXX3IRFy0InUOmYeWjvhCAgQNj-0-230-0-345-crop.jpg?v=d158027eb4,https://a.ltrbxd.com/resized/sm/upload/xm/yg/qr/pw/how-to-train-10-1200-1200-675-675-crop-000000.jpg?v=302fab52e6,Success
