imdb_id,original_title,alternative_titles,release_year,genres,directors,actors,summary,length,rating,rating_max,rating_num,detail_url,poster_url,backdrop_url,status
tt1013752,Fast & Furious,Fast & Furious/Wild Speed/The Fast and the Furious (A todo gas)/Bŭrzi i yarostni/Oi Machités ton Drómon/Форсаж/Paklene ulice/Forsazh/玩命關頭/速度与激情/Quá Nhanh Quá Nguy Hiểm/狂野時速1/The Fast and the Furious: The Original/Fast and Furious/Forsaj/F&F1 - The Fast And The Furious/Fast & Furious 1/Rápido y furioso/Hızlı ve Öfkeli/A todo gas/Hurjapäät/Velocidade Furiosa/Halálos iramban/Szybcy i wściekli/Rýchlo a zbesilo/Rychle a zběsile/מהיר ועצבני/เร็ว...แรงทะลุนรก/Паклене улице/Οι Μαχητές των Δρόμων/Kiired ja vihased/분노의 질주/Бързи и яростни/ワイルド・スピード/Furios și iute/Velozes e Furiosos/Rapides et dangereux/سريع و خشن/Greiti ir įsiutę/狂野時速/Hitri in drzni/Brzi i žestoki/Ātrs un bez žēlastības/السرعة والغضب/سۈرئەت ۋە ھىسيات/ფორსაჟი/दि फास्ट एंड द फ्यूरियस,2009,Action/Thriller/Crime/Drama,Justin Lin,Vin Diesel/Paul Walker/Michelle Rodriguez/Jordana Brewster/John Ortiz/Laz Alonso/Gal Gadot/Jack Conley/Shea Whigham/Liza Lapira/Sung Kang/Tego Calderon/Don Omar/Mirtha Michelle/Greg Cipes/Ron Yuan/Alejandro Patiño/Joe Hursley/Cesar Garcia/Brandon T. Jackson/Mousa Kraish/Neil Brown Jr./Wilmer Calderon/J. J. Soria/Don Thai Theerathada/Robert Miano/Luis Moncada/McCaleb Burnett/Greg Collins/Monique Gabriela Curnen/Jimmy Lin/Roger Fan/Brendan Wayne/Breon Ansley/Assaf Cohen/Loren Lazerine/Lou Beatty Jr./Julian Starks/Christopher Gehrman/Marco Rodríguez/Naureen Zaim/Becky O'Donohue/Alexandra Castro/Leigh Folsom Boyd/Jeff Lam/Gilbert J. Menchaca/Frank Miranda/Kristen DeLuca/Holly Weber/Bruna Rubio/Ashley Green Elizabeth/Valenzia Algarin/Liberty Cordova/Lexi Baxter/Christian Calloway/Jerald Garner/Meredith Giangrande/Victoria Gracie/Fatimah Hassan/Adrienne McQueen/Christina Neferis/Lindsay Rosenberg/Sharon Zeev,"When a crime brings them back to L.A., fugitive ex-con Dom Toretto reignites his feud with agent Brian O’Conner. But as they are forced to confront a shared enemy, Dom and Brian must give in to an uncertain new trust if they hope to outmaneuver him. And the two men will find the best way to get revenge: push the limits of what’s possible behind the wheel.",107,2.9,5,338638,https://letterboxd.com/film/fast-furious/,https://a.ltrbxd.com/resized/film-poster/4/3/5/8/2/43582-fast-furious-0-230-0-345-crop.jpg?v=e16e161e36,https://a.ltrbxd.com/resized/sm/upload/25/pu/ll/eq/fast-and-furious-1200-1200-675-675-crop-000000.jpg?v=23f07e305d,Success
tt1714206,The Spectacular Now,The Spectacular Now/美好的现在/העכשיו המדהים/La prueba del amor/Лови момент/Şu An Muhteşem/Bu An Möhtəşəmdi/恋夏进行式/好景当前/Ονειρεμένο Τώρα/Cudowne tu i teraz/Aqui e Agora/Aquí y ahora/Захватывающее время/Az élet habzsolva jó/Kouzlo přítomného okamžiku/לחיות את הרגע/Čaro prítomného okamihu/O Maravilhoso Agora/Живея за момента/Неймовірний час/戀夏進行式/美景當前/스펙타큘라 나우/El esplendoroso presente/წარმტაცი დრო/いま、輝くときに/Ici et maintenant/ใครสักคนบนโลกใบนี้,2013,Romance/Drama/Comedy,James Ponsoldt,Miles Teller/Shailene Woodley/Masam Holden/Kaitlyn Dever/Brie Larson/Kyle Chandler/Jennifer Jason Leigh/Mary Elizabeth Winstead/Karen Strassman/Andre Royo/Bob Odenkirk/Nicci Roessler/Ava London/Whitney Goin/Levi Miller/E. Roger Mitchell/Gary Weeks/Dayo Okeniyi/Logan Mack/Valerie Payton/Christopher Nathan/Troy Willis/Whitney Christopher/Wayne Dean/Mike Hickman/Keith Silverstein/Dina Sherman/Doug Haley/Alex D'Lerma/Nico Ford,"Sutter, a popular party animal, unexpectedly meets the introverted Aimee after waking up on a stranger’s lawn. As Sutter deals with the problems in his life and Aimee plans for her future beyond school, an unexpected romance blossoms between them.",95,3.2,5,245118,https://letterboxd.com/film/the-spectacular-now/,https://a.ltrbxd.com/resized/sm/upload/9o/06/4d/er/p8XfqaxYgopBMhpka6W8WP7hulU-0-230-0-345-crop.jpg?v=af31c9caad,https://a.ltrbxd.com/resized/sm/upload/6z/fy/0t/ps/the-spectacular-now-1200-1200-675-675-crop-000000.jpg?v=2486a9bcf7,Success
tt4262980,シン・ゴジラ,Shin Godzilla/Godzilla Resurgence/God Godzilla/Shin Gojira/Годзілла: Відродження/新哥斯拉/Godzillan paluu/Ґодзілла: Відродження/Godzilla 29 - Shin Godzilla/シンゴジラ/シン・ゴジラ：オルソ/Shin Godzilla: ORTHOchromatic/Godzilla/Godzilla Ressurge/Shin Godzilla 4K/SHIN GODZILLA:ORTHOchromatic/Godzilla Returns/正宗哥吉拉/신 고질라/Годзилла: Возрождение/Годзила: Възраждане/真‧哥斯拉/ชิน ก็อดซิลล่า/Godzilla: återkomsten/Godzilla Resurge/Shin Godzilla : Sự Hồi Sinh,2016,Action/Horror/Science Fiction,Shinji Higuchi/Hideaki Anno,Hiroki Hasegawa/Yutaka Takenouchi/Satomi Ishihara/Kengo Kora/Satoru Matsuo/Mikako Ichikawa/Issey Takahashi/Kanji Tsuda/Shinya Tsukamoto/Toru Nomaguchi/Daisuke Kuroda/Ren Osugi/Kimiko Yo/Akira Emoto/Sei Hiraizumi/Toru Tezuka/Kenichi Yajima/Akira Hamada/Ikuji Nakamura/Tetsu Watanabe/Jun Kunimura/Shingo Tsurumi/Jun Hashimoto/Pierre Taki/Takumi Saitoh/KREVA/Ken Mitsuishi/Kyūsaku Shimada/Tarō Suwa/Yū Kamio/Arata Furuta/Moro Morooka/Kôsei Katô/Shohei Abe/Keisuke Koide/Hairi Katagiri/Suzuki Matsuo/Takahiro Miura/Yohta Kawase/Ren Mori/Atsuko Maeda/Kazuo Hara/Isshin Inudo/Akira Ogata/Hideaki Anno/Kihachi Okamoto/Mansai Nomura/Mayumi Ogawa/Katsuhiko Yokomitsu/Yusuke Sugiyama/Sho Oyamada/Takashi Kobayashi/Takashi Fujiki/Shota Taniguchi/Tomonori Mizuno/Keitaro Azumi/Kôichi Miwa/Yuichi Ito/Koji Seki/So Nozawa/Kou Maehara/Masayuki Shida/Charles Glover/Takao Kinoshita/Hisao Kanno/Riko Yonemura/Daisaku Nishino/Toshihito Kokubo/Michiko Iwahashi/Shoki Matsui,"When a massive, gilled monster emerges from the deep and tears through the city, the government scrambles to save its citizens. A rag-tag team of volunteers cuts through a web of red tape to uncover the monster’s weakness and its mysterious ties to a foreign superpower. But time is not on their side - the greatest catastrophe to ever befall the world is about to evolve right before their very eyes.",120,3.9,5,216981,https://letterboxd.com/film/shin-godzilla/,https://a.ltrbxd.com/resized/sm/upload/8g/5p/p4/6b/8YWirGQidtZeSEmhqvQM5FrI6N1-0-230-0-345-crop.jpg?v=10e3695a0f,https://a.ltrbxd.com/resized/sm/upload/sm/cu/z2/1z/shin-godzilla-1200-1200-675-675-crop-000000.jpg?v=6d76af80c8,Success
tt4686844,The Death of Stalin,The Death of Stalin/스탈린의 죽음/A morte de Estaline/La muerte de Stalin/La mort de Staline/Morto Stalin/se ne fa un altro/스탈린이 죽었다!/더 데스 오브 스탈린/The Death of Stalin - Hier regiert der Wahnsinn/Смерть Сталина/La Mort de Staline/Смерть Сталіна/Stalins Død/Ο Θάνατος Του Στάλιν/Sztálin halála/Stalin'in Ölümü/Смъртта на Сталин/Śmierć Stalina/A Morte de Estaline/斯大林之死/Ztratili jsme Stalina/A Morte de Stalin/סטלין מת!/Smrt Staljina/史達林死了沒？/Stalino mirtis/弊傢伙！史太林死咗/Stratili sme Stalina/Stalinova smrt/Stalinin kuolema/სტალინის სიკვდილი/スターリンの葬送狂騒曲/Moartea lui Stalin/Staļina nāve/Cái Chết Của Stalin/รัฐบาลป่วน วันสิ้นสตาลิน/La mort de Stalin,2017,Drama/Comedy/History,Armando Iannucci,Steve Buscemi/Simon Russell Beale/Jeffrey Tambor/Jason Isaacs/Michael Palin/Rupert Friend/Andrea Riseborough/Dermot Crowley/Paul Whitehouse/Paul Chahidi/Adrian McLoughlin/Paddy Considine/Olga Kurylenko/Tom Brooke/Sylvestra Le Touzel/Justin Edwards/Paul Ready/Julia Mulligan/Andrey Korzhenevskiy/Roger Ashton-Griffiths/Jeremy Limb/Andy Gathergood/Alexander Piskunov/Ruslav Neupokoev/Alla Binieieva/Nicholas Woodeson/Elaine Caxton/George Potts/Cara Horgan/Nicholas Sidi/Jonny Phillips/Alex Harvey-Brown/Tim Steed/June Watson/Adam Shaw/Daniel Tuite/David Crow/Karl Johnson/Emilio Iannucci/Daniel Booroff/Dan Mersh/Richard Brake/James Barriscale/Daniel Tatarsky/Eva Sayer/Diana Quick/Adam Ewan/Michael Ballard/Phil Deguara/Jonathan Aris/Katie McCreedy/Ewan Bailey/Leeroy Murray/Keely Smith/Sheng-Chien Tsai/Dave Wong/Sergey Korshkov/Alexander Grigorivev/Olga Dadukevich/Nastya Koshevatskaya/Danya Bochkov/Sebastian Anton/Nastya Karpenko/Gerald Lepkowski/Luke D'Silva/Daniel Chapple/Daniel Smith/Ellen Evans/Oleh Drach/Daniel Fearn/Henry Helm,"When dictator Joseph Stalin dies, his parasitic cronies square off in a frantic power struggle to become the next Soviet leader. As they bumble, brawl and back-stab their way to the top, the question remains — just who is running the government?",107,3.8,5,249140,https://letterboxd.com/film/the-death-of-stalin/,https://a.ltrbxd.com/resized/film-poster/3/3/7/5/6/5/337565-the-death-of-stalin-0-230-0-345-crop.jpg?v=7cd2c6b158,https://a.ltrbxd.com/resized/sm/upload/8l/cl/gf/sn/the-death-of-stalin-1200-1200-675-675-crop-000000.jpg?v=e16d11afcb,Success
tt0765010,Brothers,Brothers/血海兄弟/Entre Irmãos/Bracia/Frères/Brothers - Zwei Brüder. Eine Liebe./برادرها/Kardeşler/Братья/Testvérek/Hermanos/Bratři/兄弟/אחים/Fratele dispărut/브라더스/Братя/Брати/Bratia/雙情路/窒愛/الإخوة/Tình Anh Em/マイ・ブラザー/برادران/บราเธอร์ส เจ็บเกินธรรมดา/Бауырлар/ძმები/Zakon braće,2009,Drama/War/Thriller,Jim Sheridan,Tobey Maguire/Jake Gyllenhaal/Natalie Portman/Sam Shepard/Mare Winningham/Bailee Madison/Taylor Geare/Patrick John Flueger/Clifton Collins Jr./Carey Mulligan/Omid Abtahi/Navid Negahban/Ethan Suplee/Arron Shiver/Ray Prewitt/Rebekah Wiggins/Carrie Fleming/Jenny Wade/Sheila Ivy Traister/Chad Brummett/Jason E. Hill/Kevin Wiggins/Yousuf Azami/James D. Dever/Kevin Adkins/Johnnie Hector/Jeremiah Bitsui/Bill Allen/Benjamin D. Baldwin/Richard Wade/Luce Rains/Enayat Delawary/Rick La Monda/Paul Ramos/Shawn Bryant/Oscar Mejia/David Bachelor/Zachary Grand/Michael-David Aragon/Iris Dunbar/J.D. Marmion/Robert Mitchell/Collin D. Barry/Janet Sanford/Casey Sanford/Gary Moore/Eric Steinig/Colleen Frye/James Duffy/David Manzanares/Michael Castellano/Carol A. Salazar/Wendell Sweet,"When his helicopter goes down during his fourth tour of duty in Afghanistan, Marine Sam Cahill is presumed dead. Back home, brother Tommy steps in to look over Sam’s wife, Grace, and two children. Sam’s surprise homecoming triggers domestic mayhem.",105,3.5,5,241983,https://letterboxd.com/film/brothers-2009/,https://a.ltrbxd.com/resized/film-poster/4/8/0/3/1/48031-brothers-0-230-0-345-crop.jpg?v=a094193056,https://a.ltrbxd.com/resized/sm/upload/kl/m0/nq/mb/brothers-2009-1200-1200-675-675-crop-000000.jpg?v=76b1672020,Success
tt1655441,The Age of Adaline,The Age of Adaline/Éternelle Adaline/Adelainos amžius/Věčně mladá/El secreto de Adaline/Το Μυστικό της Ανταλάιν/A Idade de Adaline/Век Адалин/아델라인: 멈춰진 시간/อดาไลน์ หยุดเวลา รอปาฏิหาริย์รัก/Fuer immer Adaline/Вік Адалін/روزگار آدلین/Adaline varázslatos élete/Adaline/Adaline - L'eterna giovinezza/时光尽头的恋人/Für immer Adaline/הסיפור של אדליין/Wiek Adaline/Secretul lui Adaline/Ölümsüz Aşk/Вечната Аделайн/Navždy mladá/A Incrível História de Adaline/Вік Аделайн/時空永恆的愛戀/El secret d’Adaline/アデライン、100年目の恋/Sắc Đẹp Vĩnh Cửu/時光逆愛90年/Adelainas gadi/Brezčasna Adaline/ადელაინის ასაკი/Безвременска Аделајн/Bezvremenska Adaline,2015,Drama/Fantasy/Romance,Lee Toland Krieger,Blake Lively/Michiel Huisman/Harrison Ford/Ellen Burstyn/Kathy Baker/Amanda Crew/Lynda Boyd/Hugh Ross/Richard Harmon/Fulvio Cecere/Anjali Jay/Hiro Kanagawa/Peter J. Gray/Izabel Pearce/Cate Richardson/Jane Craven/Noel Johansen/Aaron Craven/Primo Allon/Darren Dolynski/Chris William Martin/Mark Ghanimé/Shaker Paleja/Daniel Bacon/Barclay Hope/Robert Moloney/Dee Jay Jackson/Lane Edwards/Toby Levins/Anthony Ingruber/Keith McCafferty/Serge Houde/Alison Wandzura/Demord Dann/Grace Chin,"After 29-year-old Adaline recovers from a nearly lethal accident, she inexplicably stops growing older. As the years stretch on and on, Adaline keeps her secret to herself until she meets a man who changes her life.",112,3.2,5,282697,https://letterboxd.com/film/the-age-of-adaline/,https://a.ltrbxd.com/resized/film-poster/2/2/0/7/5/4/220754-the-age-of-adaline-0-230-0-345-crop.jpg?v=483cebf29e,https://a.ltrbxd.com/resized/sm/upload/z2/du/4g/fb/age-of-adaline-1200-1200-675-675-crop-000000.jpg?v=e8d9978b30,Success
tt29344903,Den stygge stesøsteren,The Ugly Stepsister/Den stygge stedsøster/A csúf mostohatestvér/Ha'Akhot Ha'Mekho'eret/La hermanastra fea/Brzydka siostra/Гадкая сестра/Ošklivá nevlastní sestra/Çirkin Ögey Bacı/어글리 시스터/האחות המכוערת/Inetu kasuõde/丑陋的继姐/Sora vitregă cea urâtă/A Meia-Irmã Feia/Гидка сестра/醜繼妹/Cắt Ngón Thử Hài/خواهر خوانده زشت/Грозната доведена сестра/醜陋的繼妹/უშნო ნახევარდა/Çirkin Üvey Kardeş/Ružna polusestra,2025,Fantasy/Drama/Comedy/Horror,Emilie Kristine Blichfeldt,Lea Myren/Ane Dahl Torp/Thea Sofie Loch Næss/Flo Fagerli/Isac Calmroth/Malte Gårdinger/Ralph Carlsson/Cecilia Forss/Katarzyna Herman/Adam Lundgren/Willy Ramnek Petri/Kyrre Hellum/Isac Aspberg/Albin Weidenbladh/Oksana Czerkasyna/Richard Forsgren/Paweł Janyst/Piotr Czarnecki/Agnieszka Żulewska/Staffan Kolhammar/Philip Lenkowsky,"In a fairy-tale kingdom where beauty is a brutal business, Elvira battles to compete with her incredibly beautiful stepsister, and she will go to any length to catch the prince’s eye.",109,3.7,5,184520,https://letterboxd.com/film/the-ugly-stepsister/,https://a.ltrbxd.com/resized/film-poster/1/1/6/7/6/5/7/1167657-the-ugly-stepsister-0-230-0-345-crop.jpg?v=a5e7b4de55,https://a.ltrbxd.com/resized/alternative-backdrop/1/1/6/7/6/5/7/tmdb/rw81acrkXXu1JyY1BdRPZP2KkdS-1200-1200-675-675-crop-000000.jpg?v=478e4ed7e9,Success
tt9812474,Dýrið,Lamb/Jērs/LAMB/ラム/Laemb/LAMB／ラム：2021/Cordeiro/램/Ada/Агнец/Bárány/טלה/羊崽/Kuzu/El Cordero/Агнець/Lamm/Αμνός/Cừu/Janje/الماعز/Avelė/羊懼/კრავი/LAMB／ラム/Jagnje/Mielul/Lambuke/Јагње/L'agneau,2021,Drama/Fantasy/Horror,Valdimar Jóhannsson,Noomi Rapace/Hilmir Snær Guðnason/Björn Hlynur Haraldsson/Ingvar E. Sigurðsson/Ester Bibi/Sigurður Elvar Viðarson/Theodór Ingi Ólafsson/Arnþruður Dögg Sigurðardóttir/Gunnar Þor Karlsson/Lára Björk Hall,"An Icelandic couple live with their herd of sheep on a beautiful but remote farm. When they discover a mysterious newborn on their land, they decide to keep it and raise it as their own. This unexpected development and the prospects of a new family brings them much joy before ultimately destroying them.",106,3.1,5,200474,https://letterboxd.com/film/lamb-2021/,https://a.ltrbxd.com/resized/film-poster/7/0/7/1/1/4/707114-lamb-0-230-0-345-crop.jpg?v=06329d82b2,https://a.ltrbxd.com/resized/sm/upload/zr/kz/3q/xt/lamb-1200-1200-675-675-crop-000000.jpg?v=524ecd4303,Success
tt0069762,Badlands,Badlands/Malas tierras/Пустоши/La rabbia giovane/Terra de Ninguém/Det grymma landet/황무지/恶土/不毛之地/Qanlı Torpaq/Badlands - Zerschossene Träume/La Balade sauvage/Noivos Sangrentos/Zapadákov/穷山恶水/שבילי הזעם/Kanlı Toprak/Sivár vidék/Опасни земи/Males terres/Безплідні землі/地獄の逃避行/Đất Dữ/უდაბნო/Julma maa/窮山惡水,1973,Crime/Romance/Drama,Terrence Malick,Martin Sheen/Sissy Spacek/Warren Oates/Ramon Bieri/Alan Vint/Gary Littlejohn/John Carter/Bryan Montgomery/Gail Threlkeld/Charles Fitzpatrick/John Womack Jr./Howard Ragsdale/Dona Baldwin/Ben Bravo/Terrence Malick/Li Baolong/Charlie Sheen/Emilio Estevez,An impressionable teenage girl from a dead-end town and her older greaser boyfriend embark on a killing spree in the South Dakota badlands.,94,4.0,5,158320,https://letterboxd.com/film/badlands/,https://a.ltrbxd.com/resized/film-poster/4/9/8/4/4/49844-badlands-0-230-0-345-crop.jpg?v=d57e83e76f,https://a.ltrbxd.com/resized/sm/upload/xb/c4/3s/xf/badlands-1200-1200-675-675-crop-000000.jpg?v=bfa2810e95,Success
tt6628394,Bad Times at the El Royale,"Bad Times at the El Royale/배드 타임 앳 더 엘 로얄/7 Sconosciuti a El Royale/ห้วงวิกฤตที่ เอล โรแยล/Sale temps à l'hôtel El Royale/Malos tiempos en El Royale/El Royale'de Zor Zamanlar/賊眉賊眼大酒店/皇家酒店谋杀案/Malos momentos en el Hotel Royale/Ничего хорошего в отеле «Эль рояль»/Поганi часи у Ель Роялi/Δύσκολες Ώρες Στο Ελ Ροαγιάλ/Тежки времена в ""Ел Роял""/זמנים קשוחים באל רויאל/Maus Momentos no Hotel Royale/7 sconosciuti a El Royale/Sete Estranhos no El Royale/Zlé časy v El Royale/Zlý časy v El Royale/Húzós éjszaka az El Royale-ban/Źle się dzieje w El Royale/Тешка времена у Ел Ројалу/壞事大飯店/Vremuri grele la El Royale/배드 타임즈: 엘 로얄에서 생긴 일/Malos Momentos en el Hotel Royale/Sunkūs laikai viešbutyje „El Royale“/Grūtie laiki viesnīcā ""El Royale""/Težave v motelu El Royale/ホテル・エルロワイヤル/Phút Kinh Hoàng Tại El Royale/ცუდი მოგონებები სასტუმრო ელ როიალთან/خان جەمەت مېھمانخانسىدىكى قاتىللىق",2018,Crime/Mystery/Thriller/Drama,Drew Goddard,Jeff Bridges/Cynthia Erivo/Lewis Pullman/Dakota Johnson/Cailee Spaeny/Jon Hamm/Chris Hemsworth/Nick Offerman/Xavier Dolan/Shea Whigham/Mark O'Brien/Charles Halford/Jim O'Heir/Gerry Nairn/Alvina August/London Morrison/Bethany Brown/Rebecca Toolan/Hannah Zirke/Billy Wickman/Charlotte Mosby/William B. Davis/Manny Jacinto/Tally Rodin/Sophia Lauchlin Hirt/Jonathan Whitesell/Synto D. Misati/Austin A.J. Abell/Katharine Isabelle/Sarah Smyth/Richard Nixon/Jocelyne Gaumond/Austin James/Caroline Koziol/James Quach/John Specogna/Stephen Stanton/Vincent Washington,"Lake Tahoe, 1969. Seven strangers, each one with a secret to bury, meet at El Royale, a decadent motel with a dark past. In the course of a fateful night, everyone will have one last shot at redemption.",141,3.5,5,255163,https://letterboxd.com/film/bad-times-at-the-el-royale/,https://a.ltrbxd.com/resized/film-poster/3/7/8/4/7/3/378473-bad-times-at-the-el-royale-0-230-0-345-crop.jpg?v=3c8a34b920,https://a.ltrbxd.com/resized/sm/upload/en/ad/g2/u2/bad-times-at-the-el-royale-1200-1200-675-675-crop-000000.jpg?v=4d4ed29d5a,Success
tt12789558,Belfast,Belfast/벨파스트/Belfāsta/Белфаст/贝尔法斯特/בלפסט/بلفاست/Belfastas/ベルファスト/貝爾法斯特/بيلفاست/เบลฟาสต์/ბელფასტი/बेलफ़ास्ट/Hồi Ký Belfast,2021,History/Drama,Kenneth Branagh,Jude Hill/Jamie Dornan/Caitríona Balfe/Lewis McAskie/Judi Dench/Ciarán Hinds/Lara McDonnell/Colin Morgan/Gerard Horan/Josie Walker/Olive Tennant/Michael Maloney/Turlough Convery/Conor MacNeill/Chris McCurry/Elly Condron/Samuel Menhinick/Vanessa Ifediora/Gerard McCarthy/Sid Sagar/Mark Hadfield/John Sessions/Mairéad Tyers/Drew Dillon/Leonard Buckley/Kit Rakusen/Freya Yates/Nessa Eriksson/Charlie Barnard/Frankie Hastings/Caolan McCarthy/Ian Dunnett Jnr/Oliver Savell/Orla McDonagh/Ross O'Donnellan/Olivia Flanagan/Serrana Su-Ling Bliss/Rachel Feeney/Estelle Cousins/Scott Gutteridge/Bill Branagh/Joyce Branagh/James O'Donnell/Victor Alli/Matthew Blaney/Scarlett Nunes,"Buddy is a young boy on the cusp of adolescence, whose life is filled with familial love, childhood hijinks, and a blossoming romance. Yet, with his beloved hometown caught up in increasing turmoil, his family faces a momentous choice: hope the conflict will pass or leave everything they know behind for a new life.",98,3.5,5,226015,https://letterboxd.com/film/belfast/,https://a.ltrbxd.com/resized/film-poster/6/9/6/6/3/0/696630-belfast-0-230-0-345-crop.jpg?v=d286601381,https://a.ltrbxd.com/resized/sm/upload/42/fx/s7/lb/belfast-1200-1200-675-675-crop-000000.jpg?v=02b012a8d7,Success
tt0320661,Kingdom of Heaven,Kingdom of Heaven/Cruzada/Kingdom Of Heaven Director's Cut/Nebesko kraljevstvo/Cruzada: El Reino de los Cielos/To vasileio ton ouranon/To basileio ton ouranon/Kingdom Of Heaven Director's Cut Roadshow/The Crusades/Königreich der Himmel/Le crociate - Kingdom of Heaven/Mennyei királyság/El reino de los cielos/Царство небесное/Království nebeské/天国王朝/Cennetin Krallığı/Kingdom of Heaven - taivas maan päällä/Reino dos Céus/Królestwo niebieskie/Kráľovstvo nebeské/Небесно царство/Το Βασίλειο των Ουρανών/ממלכת גן עדן/킹덤 오브 헤븐/Царство небесне/Regatul Cerului/Debesu valstība/キングダム・オブ・ヘブン/Dangaus karalystė/王者天下/El regne del cel/天國驕雄/Vương Quốc Thiên Đường/قلمرو بهشت/مملكة الجَنَّة/มหาศึกกู้แผ่นดิน/Kraljevstvo nebesko/Le royaume des cieux/Небеско краљевство/Taevane kuningriik/ზეციური სამეფო,2005,History/Drama/Action/Adventure/War,Ridley Scott,Orlando Bloom/Eva Green/Jeremy Irons/David Thewlis/Ghassan Massoud/Liam Neeson/Brendan Gleeson/Marton Csokas/Alexander Siddig/Michael Sheen/Khaled El Nabawy/Nikolaj Coster-Waldau/Kevin McKidd/Velibor Topic/Jon Finch/Ulrich Thomsen/Jouko Ahola/Shane Attwooll/Peter Cant/Nathalie Cox/Emilio Doorgasingh/Samira Draa/Ériq Ebouaney/Giannina Facio/Iain Glen/Philip Glenister/Martin Hancock/Lotfi Yahya Jedidi/Nasser Memarzia/Steven Robertson/Matthew Rutherford/Karim Saleh/Michael Shaeffer/Bronson Webb/Angus Wright/Edward Norton,"After his wife dies, a blacksmith named Balian is thrust into royalty, political intrigue and bloody holy wars during the Crusades.",144,3.7,5,219263,https://letterboxd.com/film/kingdom-of-heaven/,https://a.ltrbxd.com/resized/sm/upload/yo/63/zv/99/2pE4pTT8IXF56fiWMOk7cv7Fkpi-0-230-0-345-crop.jpg?v=3fa83a60a6,https://a.ltrbxd.com/resized/sm/upload/ev/n8/3s/8y/kingdom1-1200-1200-675-675-crop-000000.jpg?v=ee9255ce0b,Success
