imdb_id,original_title,alternative_titles,release_year,genres,directors,actors,summary,length,rating,rating_max,rating_num,detail_url,poster_url,backdrop_url,status
tt0212338,Meet the Parents,Meet the Parents/Pgosh et Ha-Horim/Njeni roditelji/Zapoznaĭ se s nashite/Gamprós tis symforás/Znakomstvo s roditelyami/Znayomstvo z batʹkamy/Meine Braut/ihr Vater und ich/Mon beau-père et moi/Знайомство з батьками/Знакомство с родителями/Ti presento i miei/Zor Baba/拜见岳父大人/Um Sogro do Pior/Perhe on painajainen/Γαμπρός της Συμφοράς/Los padres de ella/Apádra ütök/Foter je lotor/Släkten är värst/Запознай се с нашите/Slekten Er Verst/Fotr je lotr/Poznaj mojego tatę/Un socru de coșmar/פגוש את ההורים/Entrando Numa Fria/ミート・ザ・ペアレンツ/미트 페어런츠/Њени родитељи/Iepazīsties/mani vecāki/La familia de mi novia/Njeni tastari/Dozvola za brak/Kohtumine äiaga/Paskutinis jaunikio išbandymas/შეხვედრა მშობლებთან/門當父不對/非常外父揀女婿/La Belle-Famille/Gặp Gỡ Thông Gia/Els pares d’ella/เขยซ่าส์ พ่อตาแสบส์,2000,Comedy/Romance,Jay Roach,Ben Stiller/Robert De Niro/Teri Polo/Blythe Danner/Nicole DeHuff/Jon Abrahams/Owen Wilson/James Rebhorn/Tom McCarthy/Phyllis George/Kali Rocha/Bernie Sheredy/Judah Friedlander/Peter Bartlett/John Elsen/Mark Hammer/Amy Hohn/William Severs/John Fiore/Marilyn Dobrin/Marci Reid/Frank Santorelli/Russell Hornsby/Patricia Cook/Cody Arens/Cole Hawkins/Spencer Breslin/Ina Rosenthal/Kim Rideout/Kresh Novakovic/John Joseph Gallagher/G.A. Aguilar/Lynn Ann Castle,"Greg Focker is ready to marry his girlfriend, Pam, but before he pops the question, he must win over her formidable father, humorless former CIA agent Jack Byrnes, at the wedding of Pam’s sister. As Greg bends over backward to make a good impression, his visit to the Byrnes home turns into a hilarious series of disasters, and everything that can go wrong does, all under Jack’s critical, hawklike gaze.",108,3.3,5,340254,https://letterboxd.com/film/meet-the-parents/,https://a.ltrbxd.com/resized/film-poster/5/0/9/3/7/50937-meet-the-parents-0-230-0-345-crop.jpg?v=238ab9236a,https://a.ltrbxd.com/resized/sm/upload/py/nx/0v/lp/meet-the-parents-1200-1200-675-675-crop-000000.jpg?v=b675917d99,Success
tt4225622,The Babysitter,The Babysitter/Babysitter 1/The/撒旦保姆/Opiekunka/La babysitter/辣手保姆/A Babá/Няня/Η Νταντά/השמרטפית/A bébiszitter/Детегледачката/Bona/La niñera/Bebek Bakıcısı/사탄의 베이비시터/Нянька/Chůva na zabití/เดอะ เบบี้ซิตเตอร์/Cô Giữ Trẻ/Auklė/پرستار بچه/Pestúnka na zabitie/جليسة الأطفال/ザ・ベビーシッター,2017,Horror/Comedy,McG,Judah Lewis/Samara Weaving/Robbie Amell/Hana Mae Lee/Bella Thorne/Emily Alyn Lind/Andrew Bachelor/Doug Haley/Leslie Bibb/Ken Marino/Samuel Gilbert/Zachary Alexander Rice/Doc Duhame/Jean Claude Leuyer/Miles J. Harvey/Chris Wylde/Carl McDowell/Jonathan Bray/Jimmy Warden/Frederick Keeve/Ron Funches/Mark Mammone/Emily Brobst,"When Cole stays up past his bedtime, he discovers that his hot babysitter is part of a Satanic cult that will stop at nothing to keep him quiet.",85,2.7,5,349903,https://letterboxd.com/film/the-babysitter-2017/,https://a.ltrbxd.com/resized/film-poster/3/5/3/2/7/3/353273-the-babysitter-2017-0-230-0-345-crop.jpg?v=14e9b4c5cf,https://a.ltrbxd.com/resized/sm/upload/yd/w0/pm/48/babysitter-1200-1200-675-675-crop-000000.jpg?v=17e04b829d,Success
tt0910936,Pineapple Express,Pineapple Express/Superfumados/Alta Pedrada/Ananas Express/Strafumati/Üşütük Kafalar/Délire Express/Ананасовый экспресс: Сижу/курю/Ananász expressz/Φούντα Εξπρές/Boski chillout/菠萝快车/Travička zelená/Ананас експрес/Trávička zelená/Ананас Експрес/פיינאפל אקספרס/파인애플 익스프레스/Ananas express/Piña express/Segurando as Pontas/Zadetki: Ananas ekspres/Ананасовий експрес/菠蘿快遞/Pineapple Express: O afacere riscantă/Ngọn Dứa Thần Tốc/قطار الأناناس السريع/Mari Huanos Ekspresas/Ananas ekspres/ანანასის ექსპრესი/スモーキング・ハイ/วุ่นเเล้วตู จู่ๆ ก็โดนล่า/Ananassiekspress/Superfumats,2008,Crime/Action/Comedy,David Gordon Green,Seth Rogen/James Franco/Gary Cole/Danny McBride/Rosie Perez/Kevin Corrigan/Craig Robinson/Amber Heard/Ed Begley Jr./Nora Dunn/Bobby Lee/James Remar/Joe Lo Truglio/Art Napiontek/Cleo King/Bill Hader/Jonathan Spencer/Dana Lee/Ken Jeong/David C. Cook/Howard S. Lefstein/Connie Sawyer/David McDivitt/Mae LaBorde/Kendall Carly Browne/George Lew/John Robert Tramutola/Adam Crosby/Andrew Heald/Jeannetta Arnette/Carlos Aleman/Omar Leyva/Sam Carson/Jack Kehler/Robert Longstreet/Peter Gray Lewis/Steve Bannos/Eddie Rouse/Mark Whigham/Brian Scannell/Troy Gentile/Jourdan Lee,A stoner and his dealer are forced to go on the run from the police after the pothead witnesses a cop commit a murder.,111,3.3,5,332237,https://letterboxd.com/film/pineapple-express/,https://a.ltrbxd.com/resized/film-poster/4/6/4/6/2/46462-pineapple-express-0-230-0-345-crop.jpg?v=671682c7b0,https://a.ltrbxd.com/resized/sm/upload/8o/cj/t9/oi/pineapple-express-1200-1200-675-675-crop-000000.jpg?v=7bd5bd3f5c,Success
tt0073650,Salò o le 120 giornate di Sodoma,"Salò, or the 120 Days of Sodom",1975,Drama/Horror,Pier Paolo Pasolini,Paolo Bonacelli/Giorgio Cataldi/Uberto Paolo Quintavalle/Aldo Valletti/Caterina Boratto/Elsa De Giorgi/Hélène Surgère/Sonia Saviange/Sergio Fascetti/Bruno Musso/Antonio Orlando/Claudio Cicchetti/Franco Merli/Umberto Chessari/Lamberto Book/Gaspare Di Jenno/Giuliana Melis/Faridah Malik/Graziella Aniceto/Renata Moar/Dorit Henke/Antiniska Nemour/Benedetta Gaetani/Olga Andreis/Tatiana Mogilansky/Susanna Radaelli/Giuliana Orlandi/Liana Acquaviva/Rinaldo Missaglia/Giuseppe Patruno/Guido Galletti/Efisio Etzi/Claudio Troccoli/Fabrizio Menichini/Maurizio Valaguzza/Ezio Manni/Paola Pieracci/Carla Terlizzi/Anna Maria Dossena/Anna Recchimuzzi/Ines Pellegrini/Marco Lucantoni/Dante Trazzi,"Four corrupted fascist libertines round up 9 teenage boys and girls and subject them to 120 days of sadistic physical, mental and sexual torture.",116,3.1,5,166952,https://letterboxd.com/film/salo-or-the-120-days-of-sodom/,https://a.ltrbxd.com/resized/film-poster/4/8/8/6/5/48865-salo-or-the-120-days-of-sodom-0-230-0-345-crop.jpg?v=d44ef57732,https://a.ltrbxd.com/resized/sm/upload/1x/dg/bm/q2/salo-1200-1200-675-675-crop-000000.jpg?v=5c31031200,Success
tt1024255,Wild Child,Wild Child/Puberťačka/Diva adolescente/Wild Child - Erstklassig zickig/Garota Mimada/Asi Kız/Vadócka/Megapetarda/Divoška/Wild Child. Zbuntowana księżniczka/Miúda Insuportável/ילדת פרא/野孩子/Оторва/와일드 차일드/Дике дитя/Калпазанка/Buntovnica u internatu/ワイルド・ガール/Dumpiniece/Divjakinja/Chodiaca katastrofa/Copilul sălbatic/Diva Adolescente/Pasiutusi mergiotė/คุณหนูไฮโซ เปรี้ยวซ่าเกินร้อย/Tiểu Thư Giang Hồ/野蠻公主,2008,Romance/Drama/Comedy,Nick Moore,Emma Roberts/Alex Pettyfer/Natasha Richardson/Kimberley Nixon/Juno Temple/Johnny Pacar/Linzey Cocker/Aidan Quinn/Georgia King/Sophie Wu/Lexi Ainsworth/Shelby Young/Shirley Henderson/Nick Frost/Selina Cadell/Daisy Donovan/Ruby Thomas/Jason Watkins/Eleanor Turner-Moss/Maisie Preston/Tommy Kijas/Sonia Rockwell/Kelsey Sanders/Katelyn Pacitto/Kara Pacitto/Vanessa Branch/Hallie Eisenberg,"Sixteen-year-old Poppy has everything her unlimited credit cards can buy, and a spoiled attitude to match. After a final thoughtless prank, her exasperated father ships her off to boarding school in England. There, Poppy meets her match in a stern headmistress and a class full of girls who will not tolerate her selfishness.",98,3.5,5,288446,https://letterboxd.com/film/wild-child/,https://a.ltrbxd.com/resized/film-poster/4/3/4/4/1/43441-wild-child-0-230-0-345-crop.jpg?v=4c8d6af96f,https://a.ltrbxd.com/resized/sm/upload/42/05/bh/9u/epVdOHl19hj1gSMXcxhCAqQlD9s-1200-1200-675-675-crop-000000.jpg?v=b25b387868,Success
tt1055369,Transformers: Revenge of the Fallen,Transformers: Revenge of the Fallen/變形金剛：復仇之戰/Transformers 2/Transformers 2: Revenge of the Fallen/Трансформери: Помста полеглих/Transformerji 2: Mascevanje padlih/变形金刚2/Transformes 2 - A Vingança dos Derrotados/Transformers II: Revenge of the Fallen (2009)/Transformers 2: A bukottak bosszúja/Transformers 2 - La venganza de los caidos/Transformers 2: Yiqilganlar qasosi/Transformers 2 - Revenge of the Fallen/變形金剛2：狂派再起/Transformers - Die Rache/Transformers 2 - Die Rache/变形金刚2：卷土重来/トランスフォーマー／リベンジ：2009/Robot Đại Chiến 2: Bại Binh Phục Hận/Transformers 2: Yenilenlerin İntikamı/Transformers 2：Revenge Of The Fallen/Transformers 2: Uduzanların İntiqamı/Transformers: Die Rache/Transformers 2 - La vendetta del caduto/變形金剛：狂派再起/变形金刚：狂派再起/Transformers: De besegrades hämnd/Transformers - La vendetta del caduto/Трансформеры 2: Месть Падших/Transformers 2 : La Revanche/Transformers: Pomsta porazených/Transformers 2: Kaatuneiden kosto/Transformers: Yenilenlerin İntikamı/Transformers: Retaliação/Transformers: La venganza de los caídos/Transformers: Pomsta poražených/Transformers: De faldnes hævn/Transformers: A Bukottak bosszúja/Transformers. Zemsta upadłych/רובוטריקים 2: הנקמה/Трансформерси: освета пораженог/ทรานส์ฟอร์เมอร์ส 2 : อภิมหาสงครามแค้น/Transformers: Η Εκδίκηση των Ηττημένων/トランスフォーマー／リベンジ/트랜스포머: 패자의 역습/Трансформърс: Отмъщението/Transformers: Răzbunarea celor învinși/Transformers: A Vingança dos Derrotados/Transformers : La revanche/تبدیل شوندگان: انتقام فالن/Transformeriai: Nugalėtųjų kerštas/Transformers: la venganza de los caídos/Transformerji 2: Maščevanje padlih/Transformerlar: Qulaganlar intiqomi/Transformers: Bại Binh Phục Hận/Transformeri: Osveta poraženih/Transformeri 2: Pieveikto atriebība/المتحولون: الثأر من الذين سقطوا/ტრანსფორმერები: დაცემულის შურისძიება/Transformers: La venjança dels caiguts/ट्रांसफॉर्मर्स: इंतकाम के कगार पर,2009,Action/Adventure/Science Fiction,Michael Bay,Shia LaBeouf/Megan Fox/Peter Cullen/Hugo Weaving/Tony Todd/Josh Duhamel/Tyrese Gibson/John Turturro/Ramón Rodríguez/Kevin Dunn/Julie White/Isabel Lucas/John Benjamin Hickey/Matthew Marsden/Andrew Howard/Michael Papajohn/Glenn Morshower/John Eric Bentley/Erin Naas/Rainn Wilson/Katie Lowes/Jonathon Trent/Walker Howard/America Olivo/Aaron Hill/Jareb Dauplaise/John Sanderford/Christopher Curry/Cas Anvar/Michael Benyaer/Deep Roy/Ruben Martinez/Spencer Garrett/Ralph Meyering Jr./Aaron Norvell/Eric Pierpoint/Annie Korzen/Sean T. Krishnan/David Bowe/Kamal Jones/Aaron Lustig/Jim Holmes/Kristen Welker/Cornell Womack/David Luengas/Derek Alvarado/Alex Fernandez/Casey Nelson/Jason Roehm/John Nielsen/Rick Cramer/Arnold Chun/Marvin Jordan/Marc Evan Jackson/Jayson Floyd/Aaron Garrido/Josh Kelly/Joel Lambert/David Paul Olsen/Geoff Reeves/Brian Shehan/Mark Ryan/Reno Wilson/Jess Harnell/Robert Foxworth/André Sogliuzzo/Grey DeLisle/Charlie Adler/Frank Welker/Tom Kenny/Calvin Wimmer/John Di Crosta/Michael York/Kevin Michael Richardson/Robin Atkin Downes/Jenn An/Alexandra Begg/Caitlin Dulany/Andrew Hwang/Matt Iseman/Shayna Ryan/Karina Michel/Chester the Chihuahua,"Sam Witwicky leaves the Autobots behind for a normal life. But when his mind is filled with cryptic symbols, the Decepticons target him and he is dragged back into the Transformers’ war.",150,2.6,5,370947,https://letterboxd.com/film/transformers-revenge-of-the-fallen/,https://a.ltrbxd.com/resized/film-poster/4/7/7/6/9/47769-transformers-revenge-of-the-fallen-0-230-0-345-crop.jpg?v=ce2d386ed2,https://a.ltrbxd.com/resized/sm/upload/h4/xf/a6/7g/transformers-revenge-fallen-10-1200-1200-675-675-crop-000000.jpg?v=446cc04d34,Success
tt13669038,Women Talking,Women Talking/A Voz das Mulheres/Entre Mulheres/Ce qu’elles disent/A nők beszélnek/女人们的谈话/위민 토킹/Ellas hablan/Konuşan Kadınlar/Говорят женщины/Жене говоре/ウーマン・トーキング 私たちの選択/Die Aussprache/Говорять жінки/Γυναικείες Κουβέντες/Ce qu'elles disent/Women Talking - Il diritto di scegliere/Hovoří ženy/Žene govore/נשים מדברות/Tiếng Lòng Phụ Nữ/沒有聲音的女人們/Ženske govorijo/Głosy kobiet/Moterys kalba/วูเม็นทอล์คกิ้ง/Ce spun femeile/Naised räägivad/Жените говорят,2022,Drama,Sarah Polley,Rooney Mara/Claire Foy/Jessie Buckley/Judith Ivey/Ben Whishaw/Sheila McCarthy/Kate Hallett/Michelle McLeod/Liv McNeil/August Winter/Frances McDormand/Emily Mitchell/Kira Guloien/Shayla Brown/Eli Ham/Lochlan Ray Miller/Vivien Endicott Douglas/Nathaniel McParland/Marcus Craig/Will Bowes/Emily Drake/Caroline Gillis/Shannon Widdis,A group of women in an isolated religious colony struggle to reconcile their faith with a series of sexual assaults committed by the colony’s men.,104,3.8,5,184857,https://letterboxd.com/film/women-talking/,https://a.ltrbxd.com/resized/film-poster/6/9/6/3/1/0/696310-women-talking-0-230-0-345-crop.jpg?v=86d892ac55,https://a.ltrbxd.com/resized/sm/upload/5p/4m/nc/if/women-1200-1200-675-675-crop-000000.jpg?v=99a2e3d5aa,Success
tt1190080,2012,2012/2012 - Konec světa/2012 – Das Ende der Welt/2012 - Wir waren gewarnt/2012 - Fomos Avisados/Farewell Atlantis/2012 วันสิ้นโลก/二零一二/2012世界末日/2012地球毁灭/2012末日预言/2012末日預言/Năm Đại Họa 2012/۲۰۱۲ آخرالزمان,2009,Adventure/Action/Science Fiction,Roland Emmerich,John Cusack/Amanda Peet/Chiwetel Ejiofor/Thandiwe Newton/Oliver Platt/Tom McCarthy/Woody Harrelson/Danny Glover/Liam James/Morgan Lily/Zlatko Burić/Beatrice Rosen/Alexandre Haussmann/Philippe Haussmann/Johann Urb/John Billingsley/Chin Han/Osric Chau/Chang Tseng/Lisa Lu/Blu Mankuma/George Segal/Stephen McHattie/Patrick Bauchau/Jimi Mistry/Ryan McDonald/Merrilyn Gann/Henry O/Patrick Gilmore/Dean Marshall/Ron Selmour/Viv Leacock/Chris Boyd/Donna Yamamoto/Doron Bell/David Orth/Lyndall Grant/Jason Diablo/Ty Olsson/Zinaid Memišević/Vincent Cheng/Igor Morozov/BJ Harrison/Dominic Zamprogna/Karin Konoval/Mary Gillis/Rick Tae/Parm Soor/Gerard Plunkett/Paul Tryl/Andrei Kovski/Val Cole/Eve Harlow/Sean Tyson/Leonard Tenisci/Michael Buffer/Daren A. Herbert/Craig Stanghetta/Mateen Devji/Qayam Devji/Jody Thompson/Tanya Champoux/Frank C. Turner/Kinua McWatt/Laara Sadiq/Gillian Barber/Candus Churchill/Beverley Elliott/Agam Darshi/Raj Lal/Pesi Daruwalla/Jacob Blair/Jay Williams/Scott E. Miller/Anna Mae Wills/John Stewart/Ryan Cook/Brandon Haas/Eddie Hassell/Betty Phillips/Georgina Hegedos/Luis Javier/Dean Redman/Gordon Lai/Mark Docherty/Andrew Moxham/Alexandra Castillo/Farouk A. Afify/Shaun Wilson/Leo Chiang/Elizabeth Richard/Kyle Riefsnyder/George Trochta/John Mee/Geoff Gustafson/Alex Zahara/Jason Griffith/Jill Morrison/Thomas Parkinson/Leona Naidoo/Chad Riley/Simon Leung/Quentin Guyon/Nicole Rudell/Kevin Haaland/Leigh Burrows,"Dr. Adrian Helmsley, part of a worldwide geophysical team investigating the effect on the earth of radiation from unprecedented solar storms, learns that the earth’s core is heating up. He warns U.S. President Thomas Wilson that the crust of the earth is becoming unstable and that without proper preparations for saving a fraction of the world’s population, the entire race is doomed. Meanwhile, writer Jackson Curtis stumbles on the same information. While the world’s leaders race to build “arks” to escape the impending cataclysm, Curtis struggles to find a way to save his family. Meanwhile, volcanic eruptions and earthquakes of unprecedented strength wreak havoc around the world. ×",158,2.5,5,389610,https://letterboxd.com/film/2012/,https://a.ltrbxd.com/resized/film-poster/4/3/3/0/1/43301-2012-0-230-0-345-crop.jpg?v=834c36fefb,https://a.ltrbxd.com/resized/sm/upload/y4/or/o1/ff/2012-45-1200-1200-675-675-crop-000000.jpg?v=9ae275209a,Success
tt0115736,Bound,Bound/Sin límites/Liaisons interdites/バウンド/The Business/Lazos ardientes/Скок/Ligadas pelo Desejo/Preko svake mjere/Gefesselt/Παράνομα δεμένες/Fülledtség/Torbido inganno/Ryšys/Brudne pieniądze/Brudny szmal/Sem Limites/Связь/Skok/Zaveza/Llaços ardents/驚世狂花/Tuhaf İlişkiler/Зв'язок/Giới Hạn/Bound - Gefesselt/Bound - Torbido inganno/惊世狂花/Past/קשורות/Παράνομα Δεμένες/바운드/Cómplices/Обвързан/Seotud,1996,Crime/Thriller/Drama,Lana Wachowski/Lilly Wachowski,Gina Gershon/Jennifer Tilly/Joe Pantoliano/John P. Ryan/Christopher Meloni/Richard C. Sarafian/Barry Kivel/Mary Mara/Susie Bright/Margaret Smith/Peter Spellos/Ivan Kane/Kevin Michael Richardson/Gene Borkan,"Corky, a tough female ex-convict working on an apartment renovation in a Chicago building, meets a couple living next door, Caesar, a paranoid mobster, and Violet, his seductive girlfriend, who is immediately attracted to her.",105,4.0,5,160428,https://letterboxd.com/film/bound/,https://a.ltrbxd.com/resized/film-poster/4/7/2/8/9/47289-bound-0-230-0-345-crop.jpg?v=54e3ef63ae,https://a.ltrbxd.com/resized/sm/upload/89/l5/b8/80/bound-1200-1200-675-675-crop-000000.jpg?v=7715ad455a,Success
tt9495224,Black Mirror: Bandersnatch,Black Mirror: Bandersnatch/A Black Mirror Event: Bandersnatch/블랙 미러-밴더스내치/Black Mirror - Bandersnatch/ブラック・ミラー バンダースナッチ/黑镜：潘达斯奈基/Черное Зеркало: Бандерснэтч/Черное зеркало. Бандерснэтч/블랙 미러: 밴더스내치/Μαύρος Καθρέφτης: Bandersnatch/Czarne lustro: Bandersnatch/Черно огледало: Бендърснач/מראה שחורה: בנדרסנאץ’/Black Mirror Bandersnatch/Kara Ayna: Bandersnatch/黑鏡：潘達斯奈基/Black Mirror : Bandersnatch/Чорне дзеркало: Бузогриз/Juodasis veidrodis: Banderšmikas/Črno ogledalo: Bandersnatch/Fekete tükör: Interaktív/შავი სარკე: Bandersnatch/Gương Đen: Bandersnatch/ブラック・ミラー: バンダースナッチ/แบล็ก มิร์เรอร์: แบนเดอร์สแนทช์,2018,Science Fiction/Mystery/Thriller/Drama/TV Movie,David Slade,Fionn Whitehead/Craig Parkinson/Alice Lowe/Asim Chaudhry/Will Poulter/Tallulah Haddon/Catriona Knox/Paul Bradley/Jonathan Aris/A.J. Houghton/Fleur Keith/Laura Evelyn/Alan Asaad/Suzanne Burden/Jeff Minter/Sandra Teles/Rochenda Sandall/Ellie Piercy/Tom McCall/Jon-Jo Inkpen/Stephen Rashbrook,"In 1984, a young programmer begins to question reality as he adapts a dark fantasy novel into a video game. A mind-bending tale with multiple endings.",90,3.3,5,354651,https://letterboxd.com/film/black-mirror-bandersnatch/,https://a.ltrbxd.com/resized/film-poster/4/9/8/0/4/4/498044-black-mirror-bandersnatch-0-230-0-345-crop.jpg?v=ba9c453bc6,https://a.ltrbxd.com/resized/sm/upload/zp/xl/6d/2t/bandersnatch-1200-1200-675-675-crop-000000.jpg?v=563d0ccc77,Success
tt5990474,Columbus,Columbus/콜럼버스/構築心方向/Колумбус/Калъмбъс/在哥伦布/Κολόμπους/Kolumbas/コロンバス/心靈築動/קולומבוס,2017,Drama,Kogonada,"John Cho/Haley Lu Richardson/Michelle Forbes/Rory Culkin/Parker Posey/Erin Allegretti/Shani Salyers Stiles/Reen Vogel/Rosalyn R. Ross/Lindsey Shope/Jem Cohen/Caitlin Ewald/Jim Dougherty/Joseph Anthony Foronda/Alphaeus Green, Jr./Wynn Reichert","When a renowned architecture scholar falls suddenly ill during a speaking tour, his son Jin finds himself stranded in Columbus, Indiana - a small Midwestern city celebrated for its many significant modernist buildings. Jin strikes up a friendship with Casey, a young architecture enthusiast who works at the local library.",104,4.0,5,128139,https://letterboxd.com/film/columbus-2017/,https://a.ltrbxd.com/resized/sm/upload/l1/zo/7p/wc/3ZE5Wl3CdfUH4BkWRmyMKPHkWHx-0-230-0-345-crop.jpg?v=800e4a6439,https://a.ltrbxd.com/resized/sm/upload/gz/5y/bf/ns/columbus-1200-1200-675-675-crop-000000.jpg?v=e058bb485c,Success
tt9603082,All Too Well: The Short Film,All Too Well: The Short Film/Taylor Swift: All Too Well/ძალიან კარგად: მოკლე ფილმი/Demasiado bien: el cortometraje,2021,Music/Drama,Taylor Swift,Sadie Sink/Dylan O'Brien/Taylor Swift/Jake Lyon/Shawn Levy/Rashauna Eastman/Anthony Espino/Jeffrey Castillo Peña/Elise Turin/Mariama Bonetti/Laura Krstovska-Guerrero/Sophie Levy/Tess Levy/Charlie Levy/Colette Levy/Christine Brown/Megan Harris/Taylor Hennings/Erik Dawson/Jeremiah Corley/Mitchell Sink/Alex Penagos/Jodie Taylor/Diana Byrd/Matt Carignan/Jorge Dorsinville/Oscar Eli/Brianna Figueroa/Jason Homayoon/Ava Hsu/Molly Karow/Olivia Karow/Taylor Kobryn/Kamilah Marshall/Sokhna Mbaye/Ivey Monroe/Justine Newman/Melanie Nyema/Tara Prangell/Tiffany Shinn/Ally Woss/Liz June/Mira Moore/Cami Arrow/Thaddeus Langly/Anna Leonard/Doug Moritz/Stella Amberiadis/Julia Barnard/Bernadette Fong/Junio Enrique/Omar Ezat/Emily Garcia/Adam Lochridge Gerhardt/Martina Gordon/Candice Jean-Jacques/Acei Martin/Stephanie Theresa Pabon/Miroslav Piurko/Jalil Reddick/Tiana Soares/Khiry Walker,Short film featuring the extended version of the song “All Too Well” by Taylor Swift. A troubled couple’s romance blossoms before it eventually falls apart.,15,4.2,5,288156,https://letterboxd.com/film/all-too-well-the-short-film/,https://a.ltrbxd.com/resized/film-poster/8/0/7/7/6/2/807762-all-too-well-the-short-film-0-230-0-345-crop.jpg?v=96394fc6a9,https://a.ltrbxd.com/resized/sm/upload/e7/46/4u/9g/image-1200-1200-675-675-crop-000000.jpg?v=2d72f080ce,Success
tt5433140,Fast X,Fast X/Szybcy i wsciekli X/Форсаж 10/Fast 10/Fast Ten/분노의 질주 10/ワイルド・スピード10/ワイルド・スピード ファイヤーブースト/Fast & Furious: Ride or Die/The Fast and the Furious 10: Fast X/Quá Nhanh Quá Nguy Hiểm 10/فست ایکس/فست اکس/Fast & Furious X/速度与激情10/Forsaj 10/Brzi i žestoki 10/Паклене улице десет/A todo gas: 10 - Parte 1/Velozes e Furiosos 10/F&F10 - Fast X/เร็ว...แรง ทะลุนรก 10/Rapides X/Fast & Furious 10/Rápidos y Furiosos 10/狂野时速10/玩命關頭X/Velozes & Furiosos 10/Velocidade Furiosa X/Бързи и яростни 10/狂野時速 10/Rápidos y furiosos X/Форсаж Х/Hızlı ve Öfkeli 10/분노의 질주: 라이드 오어 다이/Halálos iramban 10/Szybcy i wściekli 10/מהיר ועצבני 10/ワイルド・スピード／ファイヤーブースト/Rychle a zběsile 10/السريع 10/Rýchlo a zbesilo 10/फ़ास्ट X/Паклене улице 10/Μαχητές των Δρόμων 10/Hitri in drzni X/سریع و خشن ۱۰/Greiti ir įsiutę 10/Furios și iute X/Ātrs un bez žēlastības 10/ფორსაჟი X/Kiired ja vihased X,2023,Crime/Action/Adventure/Mystery/Thriller,Louis Leterrier,"Vin Diesel/Michelle Rodriguez/Tyrese Gibson/Ludacris/John Cena/Nathalie Emmanuel/Jordana Brewster/Sung Kang/Jason Momoa/Scott Eastwood/Daniela Melchior/Alan Ritchson/Helen Mirren/Brie Larson/Jason Statham/Charlize Theron/Rita Moreno/Joaquim de Almeida/Leo Abelo Perry/Luis Da Silva, Jr./Jaz Hutchins/Luka Hays/Alexander Capon/Pete Davidson/Shadrach Agozino/Ludmilla/Miraj Grbić/Meadow Walker/Michael Irby/Shahir Figueira/Ben Santos/Debby Ryan/Joshua Dun/Dwayne Johnson/Gal Gadot/Ali Baddou/Emily Buchan/Luca De Massis/Peter Overton/Isabelle Bernardo/Sean Berube/David A. Chang/Alexandre Chen/Calvin Chen/Boye Cole/Michael K. Fox/Dan Matteucci/Cory McClane/Tony Morgan/Clément Osty/Jeremy Parisi/Justin Price/Michael Rooker/Reneque Samuels/Amber Sienna","Over many missions and against impossible odds, Dom Toretto and his family have outsmarted, out-nerved and outdriven every foe in their path. Now, they confront the most lethal opponent they’ve ever faced: A terrifying threat emerging from the shadows of the past who’s fueled by blood revenge, and who is determined to shatter this family and destroy everything—and everyone—that Dom loves, forever.",142,2.5,5,292947,https://letterboxd.com/film/fast-x/,https://a.ltrbxd.com/resized/film-poster/3/2/0/4/8/1/320481-fast-x-0-230-0-345-crop.jpg?v=58239dde0a,https://a.ltrbxd.com/resized/sm/upload/xx/zt/87/rl/fastx-1200-1200-675-675-crop-000000.jpg?v=2c78866af4,Success
